,Site Name,Article Name,Article Date,Total Article Comments,Article URL,Username,Comments,Hate?,Flag?,Responding to,Upvotes,Downvotes
638,Townhall,Steve Scalise on Gov. Whitmer's 'Sickening' Veto,['2020/08/03'],605 comments,https://townhall.com/tipsheet/cortneyobrien/2020/08/03/scalise-on-gov-whitmers-sickening-veto-n2573561,DSMike,When you force unprepared organizations to keep infected people in a pool of very vulnerable people then the incidence of infection and death will unavoidably go up...logic that even a progressive should understand...but I guess not.,,,,3,?
639,Townhall,"That's Called Terrorism, Children: Seattle Police Chief Reveals Contents of Van Imp…",['2020/07/30'],396 comments,https://townhall.com/tipsheet/mattvespa/2020/07/30/seattle-police-chief-reveals-what-was-found-inside-van-n2573418,DSMike,Now you are obfuscating...face it you lost.,,,SkippingDog,0,0
640,Townhall,New Poll: Overwhelming Majority of Americans Know Exactly Who is Respons…,['2020/07/31'],116 comments,https://townhall.com/tipsheet/katiepavlich/2020/07/31/new-poll-americans-properly-blame-china-for-wuhan-coronavirus-fiasco-n2573494,DSMike,"Nice spin but the numbers do not line up with your spin.  The spread of the virus is not the issue, hospitalizations and death rates are the main concern and as a function of population we stack up quite well.",,,JaxJJ,5,?
641,Townhall,New Poll: Overwhelming Majority of Americans Know Exactly Who is Respons…,['2020/07/31'],116 comments,https://townhall.com/tipsheet/katiepavlich/2020/07/31/new-poll-americans-properly-blame-china-for-wuhan-coronavirus-fiasco-n2573494,DSMike,The problem was that China destroyed the original research and disappeared those scientists involved in it.  Then they went on a misinformation campaign to try and make this someone else's problem.  Recently that have sold back protective equipment to other countries that donated that equipment to them...they are very dirty and it is nice to see Americans are educated on the subject.,,,,21,?
642,Townhall,New Poll: Overwhelming Majority of Americans Know Exactly Who is Respons…,['2020/07/31'],116 comments,https://townhall.com/tipsheet/katiepavlich/2020/07/31/new-poll-americans-properly-blame-china-for-wuhan-coronavirus-fiasco-n2573494,DSMike,"Our numbers actually stack up as comparable to other nations given population comparisons, except three that habitually lie.  With the exception of not stopping EU travel fast enough our response has been quite good.",,,JaxJJ,2,?
643,Townhall,"Dr. Fauci Suggested All Kinds of Limits on Churches, Refuses to Do the Same for Lef…",['2020/07/31'],457 comments,https://townhall.com/tipsheet/katiepavlich/2020/07/31/dr-fauci-refuses-to-admit-protests-spread-wuhan-coronavirus-n2573514,DSMike,"We do church online and are staying at home right now...mostly for my wife's protection as she has medical conditions that could put her at greater risk.  It is all about personal choice and accepting the consequences of your actions be they good or bad...personal responsibility.  Freedom and liberty are hard, most progressives do not like hard.",,,,1,?
644,Townhall,Pelosi Reportedly Didn't Speak Too Highly of Dr. Birx in Closed Door Meeting,['2020/07/31'],128 comments,https://townhall.com/tipsheet/cortneyobrien/2020/07/31/pelosi-reportedly-didnt-speak-too-highly-of-dr-birx-in-closed-door-meeting-n2573519,DSMike,Get your name on a card and you are the greatest person on earth...wow popularity in the progressive ideology has a very low bar.,,,,7,?
645,Townhall,Federal Courthouse Experiences Night of Relative Calm After Being Reinforced By…,['2020/07/31'],92 comments,https://townhall.com/tipsheet/juliorosas/2020/07/31/federal-courthouse-experiences-night-of-relative-calm-after-reinforced-by-oregon-state-police-n2573515,DSMike,Calm before the storm...Once the federal agents leave the city these scum will start again.,,,,1,?
646,Townhall,Ex-Police Officer Who Justifiably Shot Michael Brown in Self-Defense Won't Be…,['2020/07/31'],214 comments,https://townhall.com/tipsheet/mattvespa/2020/07/31/former-police-officer-who-justifiably-killed-michael-brown-in-selfdefense-wont-be-charged-after-reinvestigation-n2573507,DSMike,"Ahhhh...the beginnings of the cops are after black people canard.  No police officer I know wakes up and says to himself, I think I will go out and violate a minority today.  That is the myth the progressive fascists want Americans to believe.",,,,39,?
647,Townhall,Feinstein: You Know Who's Growing Increasingly 'Respectable'? China.,['2020/07/31'],153 comments,https://townhall.com/tipsheet/guybenson/2020/07/31/feinstein-you-know-whos-growing-increasingly-respectable-china-n2573508,DSMike,"The Chinese people are not bad, the government is...before the progressive fascists start calling us racists.",,,,0,0
648,Townhall,"Oh, Here We Go: DC Mayor Calls on Businesses to Narc on Customers Not Fol…",['2020/07/31'],113 comments,https://townhall.com/tipsheet/mattvespa/2020/07/31/oh-here-we-go-dc-mayor-calls-on-businesses-to-narc-on-patrons-not-following-mask-edict-n2573506,DSMike,The collective has mandated that you bend knee to the progressive fascist ideology.  What will happen to those who say no?,,,,3,?
649,Townhall,Insane: Seattle Moves to Abolish Entire Police Force,['2020/07/31'],1887 comments,https://townhall.com/tipsheet/mattvespa/2020/07/31/insane-seattle-moves-to-abolish-police-force-n2573513,DSMike,"Have at it, let the decay of the urban cesspool of Seattle accelerate...just make sure the residents that voted in these Marxist scum stay in Seattle and deal with the consequences of their vote.",,,,1,?
650,Townhall,"White House: We've Sent Democrats Four Offers to Help Americans, They've Reject…",['2020/07/31'],278 comments,https://townhall.com/tipsheet/katiepavlich/2020/07/31/white-house-weve-sent-democrats-four-offers-to-help-americans-theyve-rejected-all-of-them-n2573509,DSMike,"If they want to hold hurting Americans as political hostages then let them, and make them own it.",,,,4,?
651,Townhall,CNN Was Afraid to Say a Certain Term in Their ‘Woke’ Tweet About Cervical Cancer,['2020/07/31'],133 comments,https://townhall.com/tipsheet/mattvespa/2020/07/31/cnns-woke-tweet-about-cervical-cancer-n2573499,DSMike,Woke is dangerous for society.,,,,9,?
652,Townhall,Horror in Portland: Rioters Light Pig Head and American Flag on Fire Near Downtown,['2020/07/31'],98 comments,https://townhall.com/tipsheet/elliebufkin/2020/07/31/horror-in-portland-rioters-light-pig-head-american-flag-on-fire-near-downtown-n2573500,DSMike,"Subhuman scum, animals with rabies are put down, time to do the same with these infected animals.",,,,2,?
653,Townhall,Rep. Scalise: Even the Title of Today's Coronavirus Hearing Proves Dems Are Pl…,['2020/07/31'],353 comments,https://townhall.com/tipsheet/cortneyobrien/2020/07/31/steve-scalises-stellar-performance-at-fridays-coronavirus-hearing-n2573503,DSMike,What is good for the American people is no longer the question in DC...it is all about how each team can gather power to themselves...past time for the DC cesspool to go away.,,,,2,?
654,Townhall,Another Woman Arrested for Stealing Crucial Medical Information on Behalf of…,['2020/07/31'],100 comments,https://townhall.com/tipsheet/katiepavlich/2020/07/31/ohio-woman-pleads-guilty-to-stealing-pediatric-medical-information-for-the-chinese-communist-party-n2573492,DSMike,Lock down all trade with China until they operate honestly...time to get aggressive.,,,,3,?
655,Townhall,"Question: If a Coronavirus Vaccine Were Approved and Produced Tomorrow, Woul…",['2020/07/31'],485 comments,https://townhall.com/tipsheet/guybenson/2020/07/31/poll-if-a-coronavirus-vaccine-were-produced-tomorrow-would-you-take-it-n2573373,DSMike,Serving on a hospital board and having several doctor friends I would ask them to research teh product and if everything were on the up and up I would take it.  My wife has preexisting conditions and would never do anything to put her life in danger.,,,,1,?
656,Townhall,The Chicago Gun Myth,['2020/07/31'],154 comments,https://townhall.com/columnists/davidharsanyi/2020/07/31/the-chicago-gun-myth-n2573486,DSMike,"Progressives lie, just as easy as they breath.",,,,5,?
657,Townhall,"That's Called Terrorism, Children: Seattle Police Chief Reveals Contents of Van Imp…",['2020/07/30'],396 comments,https://townhall.com/tipsheet/mattvespa/2020/07/30/seattle-police-chief-reveals-what-was-found-inside-van-n2573418,DSMike,"Violation of criminal laws...not there, but with the evil left wing rioters it is...hmmmmmm.",,,SkippingDog,0,0
658,Townhall,Epstein Docs Were Unsealed. The FBI Knew About Creepy Allegations…And Did Noth…,['2020/07/31'],611 comments,https://townhall.com/tipsheet/mattvespa/2020/07/31/maxwellepstein-docs-n2573489,DSMike,"Sad for these girls and sad that we are supposed to be a nation of laws...but those laws and our legal system turned a blind eye to these victims, because of politics.  We should have much more shame for this event than any past sins we may have been involved in, we are supposed to grow as a nation and become better but alas it seems we have not done so.",,,,2,?
659,Townhall,How One Progressive Grandma Outed Her Portland Anarchist Grandson,['2020/07/31'],116 comments,https://townhall.com/tipsheet/leahbarkoukis/2020/07/31/anarchist-who-threw-ied-at-courthouse-identified-by-his-grandma-n2573346,DSMike,Generational insurrection = generational welfare...the evil left in a nutshell.,,,,1,?
660,Townhall,Acting DHS Secretary: The Portland Mayor Is 'Not Telling the Truth',['2020/07/31'],288 comments,https://townhall.com/tipsheet/cortneyobrien/2020/07/31/chad-wolf-condemns-portland-mayor-for-misleading-the-public-n2573497,DSMike,"Illegal and legal immigration, peaceful protest and violent uprising...the evil left in our nation never tells we the people the truth, they spin and obfuscate issues to try and make their stance more palatable to our good citizens.  There was a regime in Europe in the 1930s that did much the same, one day our nation will figure it out, but will we still be a nation by then?",,,,3,?
661,Townhall,"Sen. Tim Scott, Captain America 'Disagree Without Being Disagreeable'",['2020/07/30'],25 comments,https://townhall.com/tipsheet/madelinepeltzer/2020/07/30/sen-tim-scott-chris-evans-disagree-without-being-disagreeable-n2573445,DSMike,"There are no very few dems, most are now full blown Marxists...that is the issue.",,,,0,0
662,Townhall,"That's Called Terrorism, Children: Seattle Police Chief Reveals Contents of Van Imp…",['2020/07/30'],396 comments,https://townhall.com/tipsheet/mattvespa/2020/07/30/seattle-police-chief-reveals-what-was-found-inside-van-n2573418,DSMike,"No violence, no terrorism...did you miss the definition?",,,SkippingDog,2,?
663,Townhall,"That's Called Terrorism, Children: Seattle Police Chief Reveals Contents of Van Imp…",['2020/07/30'],396 comments,https://townhall.com/tipsheet/mattvespa/2020/07/30/seattle-police-chief-reveals-what-was-found-inside-van-n2573418,DSMike,"No storming went on, again your fantasy world seems to be interfering with reality, you should see someone about that.",,,SkippingDog,0,0
664,Townhall,"That's Called Terrorism, Children: Seattle Police Chief Reveals Contents of Van Imp…",['2020/07/30'],396 comments,https://townhall.com/tipsheet/mattvespa/2020/07/30/seattle-police-chief-reveals-what-was-found-inside-van-n2573418,DSMike,"When did that happen?  Your confusion between reality and fantasy is alarming.  There were people who showed up and protested, but no capitols were stormed that i could find.  Kind of sad that you have to lie to make a point.",,,SkippingDog,0,0
665,Townhall,Local Reporter Absolutely Shreds Local Seattle Leaders For Their Gross Hypocris…,['2020/07/30'],171 comments,https://townhall.com/tipsheet/mattvespa/2020/07/30/local-reporter-absolutely-shreds-local-seattle-leaders-for-their-gross-hypocrisy-over-riots-n2573421,DSMike,"Wonders never cease, a journalist telling it like it is, a rarity.",,,,36,?
666,Townhall,Pompeo: The Tide is Turning Against China,['2020/07/30'],7 comments,https://townhall.com/tipsheet/katiepavlich/2020/07/30/pompeo-the-tide-is-turning-against-china-n2573448,DSMike,"Good start, starve them out economically.",,,,4,?
667,Townhall,President Obama Gets Political at John Lewis's Funeral,['2020/07/30'],360 comments,https://townhall.com/tipsheet/cortneyobrien/2020/07/30/obama-gets-political-at-john-lewiss-funeral-n2573455,DSMike,When does Obama not get political?  No class is the charge I have heard before.,,,,2,?
668,Townhall,Victory: Missouri AG Intervenes to Drop Charges Against St. Louis Couple Who Fe…,['2020/07/30'],605 comments,https://townhall.com/tipsheet/mattvespa/2020/07/30/victory-missouri-ag-intervenes-to-drop-charges-against-couple-who-fended-off-mob-n2573458,DSMike,"When your right to defend you and yours is in question then the tyrannical minded people win, along with the criminal class.",,,,14,?
669,Townhall,Tough First Week: Ratings For Joy Reid's New Primetime Show Dropped Like a Sto…,['2020/07/30'],325 comments,https://townhall.com/tipsheet/elliebufkin/2020/07/30/tough-first-week-ratings-for-joy-reids-new-primetime-show-dropped-like-a-stone-n2573441,DSMike,When hatred is your default position on all subjects then your show will wear on the nerves of normal people quickly.,,,,12,?
670,Townhall,BREAKING: Herman Cain Has Died of Coronavirus,['2020/07/30'],1010 comments,https://townhall.com/tipsheet/mattvespa/2020/07/30/herman-cain-has-died-of-coronavirus-n2573430,DSMike,Two days after the event...at the very edges of the incubation period.,,,True Patriot,0,0
671,Townhall,"No One Is Going to Do That, Bro: Dr. Fauci's Latest COVID Precaution Is Just Laughable",['2020/07/30'],308 comments,https://townhall.com/tipsheet/mattvespa/2020/07/30/no-one-is-going-to-do-that-bro-dr-faucis-latest-covid-precaution-is-just-laug-n2573424,DSMike,If the dems win in November then watch how fast all of these guidelines and lock-downs evaporate...It has never been about the virus it has been about gaining power for the evil left.,,,,13,?
672,Townhall,"ESPN Bombshell: NBA 'Academies' in China Rife With Abuses, League Accused of Lies…",['2020/07/30'],94 comments,https://townhall.com/tipsheet/guybenson/2020/07/30/espn-china-nba-bombshell-n2573405,DSMike,Leftist bird of a feather...all evil and all scum.,,,,3,?
673,Townhall,BREAKING: Arguments for Dismissing Flynn Case to Be Reheard,['2020/07/30'],557 comments,https://townhall.com/tipsheet/katiepavlich/2020/07/30/flynn-n2573444,DSMike,"Most criminals who have been found to have been railroaded by over zealous police and prosecutors have their cases dismissed...which is a good thing.  Here we have political games getting involved in just such a circumstance, that is called corruption.",,,,9,?
674,Townhall,"Oh, So That’s Who Firebombed Democrat Headquarters in Phoenix",['2020/07/30'],159 comments,https://townhall.com/tipsheet/katiepavlich/2020/07/30/oh-so-thats-who-lit-a-democrat-headquarter-building-on-fire-n2573422,DSMike,Now that it is proven to not be a right wing terrorist but a left wing one we will hear crickets from the media.  You can always count on the evil left wing and brown shirted propagandists to carry the water for their masters.,,,,2,?
675,Townhall,Fake News: Why You Shouldn't Believe the Liberal Media Over the Latest Economic…,['2020/07/30'],180 comments,https://townhall.com/tipsheet/mattvespa/2020/07/30/fake-news-why-you-shouldnt-believe-the-liberal-media-over-the-latest-economic-report-n2573425,DSMike,The evil left wing propagandists at it again...the president needs to tweet a rebuttal and quickly.,,,,0,0
676,Townhall,"Trump Blasts Mail-In Voting Plans as 'Inaccurate and Fraudulent,' Suggests De…",['2020/07/30'],172 comments,https://townhall.com/tipsheet/elliebufkin/2020/07/30/trump-blasts-mailin-voting-plans-as-inaccurate-and-fraudulent-suggests-delaying-election-n2573428,DSMike,"Yeah, thirty million lost ballots...nothing to see here.",,,LoudLiberal,1,?
677,Townhall,"Trump Blasts Mail-In Voting Plans as 'Inaccurate and Fraudulent,' Suggests De…",['2020/07/30'],172 comments,https://townhall.com/tipsheet/elliebufkin/2020/07/30/trump-blasts-mailin-voting-plans-as-inaccurate-and-fraudulent-suggests-delaying-election-n2573428,DSMike,"30 million ballots lost over the years and rampant fraudulent voters and incidents...what could go wrong, right?   The evil left no longer has the high ground when it comes to election security, if they ever did.",,,,3,1
678,Townhall,NASA Launches Rover to Look for Life on Mars,['2020/07/30'],19 comments,https://townhall.com/tipsheet/micaelaburrow/2020/07/30/nasa-launches-rover-to-look-for-life-on-mars-n2573426,DSMike,"Risk aversion in space exploration has cost us dearly, we should be much farther along than we are.",,,,6,?
679,Townhall,BREAKING: Herman Cain Has Died of Coronavirus,['2020/07/30'],1010 comments,https://townhall.com/tipsheet/mattvespa/2020/07/30/herman-cain-has-died-of-coronavirus-n2573430,DSMike,He tested positive two days later as per the story...,,,yankee170,1,?
680,Townhall,BREAKING: Herman Cain Has Died of Coronavirus,['2020/07/30'],1010 comments,https://townhall.com/tipsheet/mattvespa/2020/07/30/herman-cain-has-died-of-coronavirus-n2573430,DSMike,Reaction a hoax versus the actual virus...it is amazing that we actually have to think for you scum.,,,GenX Marketing Guy,0,0
681,Townhall,BREAKING: Herman Cain Has Died of Coronavirus,['2020/07/30'],1010 comments,https://townhall.com/tipsheet/mattvespa/2020/07/30/herman-cain-has-died-of-coronavirus-n2573430,DSMike,Two days...read much?,,,yankee170,0,0
682,Townhall,BREAKING: Herman Cain Has Died of Coronavirus,['2020/07/30'],1010 comments,https://townhall.com/tipsheet/mattvespa/2020/07/30/herman-cain-has-died-of-coronavirus-n2573430,DSMike,"Want to see a fascist, look in the mirror leftist subhuman scum.",,,yankee170,0,0
683,Townhall,BREAKING: Herman Cain Has Died of Coronavirus,['2020/07/30'],1010 comments,https://townhall.com/tipsheet/mattvespa/2020/07/30/herman-cain-has-died-of-coronavirus-n2573430,DSMike,"Rally was not the likely place for him to have caught it, does not line up with median COVID incubation period.",,,True Patriot,5,?
684,Townhall,BREAKING: Herman Cain Has Died of Coronavirus,['2020/07/30'],1010 comments,https://townhall.com/tipsheet/mattvespa/2020/07/30/herman-cain-has-died-of-coronavirus-n2573430,DSMike,"Because there has been no attempt, only talk...pretty easy even for a progressive fascist.",,,yankee170,2,?
685,Townhall,BREAKING: Herman Cain Has Died of Coronavirus,['2020/07/30'],1010 comments,https://townhall.com/tipsheet/mattvespa/2020/07/30/herman-cain-has-died-of-coronavirus-n2573430,DSMike,"Prayers for him and his loved ones...we lost an excellent American today and all should be sad.  However to assume he contracted COVID from the Trump rally is not really in keeping with the median incubation time for the virus and is frankly on the very edge of the incubation period, 2-14 days.  But that will not stop the evil left from claiming this as fact, science deniers.",,,,5,?
686,Townhall,New Polls: Trump Turning Things Around?,['2020/07/30'],397 comments,https://townhall.com/tipsheet/guybenson/2020/07/30/polls-trump-turning-it-around-n2573357,DSMike,"With the violent and hate filled nature of the current left wing ideology coupled with a candidate that looks increasingly cowardly I would not put it past Trump to win again.  If the economy continues it upward swing then that will be even more bad news for the dems.  Still along way to go, but the current nature of the left wing movement in America does not bode well for them.",,,,5,?
687,Townhall,"That's Called Terrorism, Children: Seattle Police Chief Reveals Contents of Van Imp…",['2020/07/30'],396 comments,https://townhall.com/tipsheet/mattvespa/2020/07/30/seattle-police-chief-reveals-what-was-found-inside-van-n2573418,DSMike,"Terrorism....the unlawful use of violence and intimidation in the pursuit of political aims.  Seems we have terrorists on our hands.  Protest peacefully, that is a good thing...terrorism is not.",,,,29,?
688,Townhall,Results: Nearly Two Dozen Federal Arrests Made in Chicago,['2020/07/30'],66 comments,https://townhall.com/tipsheet/katiepavlich/2020/07/30/barr-gets-results-nearly-two-dozen-federal-arrests-made-in-chicago-n2573403,DSMike,Drop in the bucket and many more to go...let's roll.,,,,2,?
689,Townhall,MSNBC Host to Black Trump Supporter: Are You Being Paid to Support Trump?,['2020/07/30'],292 comments,https://townhall.com/tipsheet/cortneyobrien/2020/07/30/msnbc-host-to-black-trump-supporter-are-you-being-paid-to-support-trump-n2573385,DSMike,"And the black public shaming commences, the leftist scum know no shame.",,,,17,?
690,Townhall,"Seriously, Lady: PA Dem Who AG Barr Laughed At During That Clown Show Hea…",['2020/07/29'],709 comments,https://townhall.com/tipsheet/mattvespa/2020/07/29/pa-dem-who-ag-barr-laughed-at-during-clown-show-hearing-took-a-racial-swipe-at-hi-n2573366,DSMike,"Truth is now the enemy and must be suppressed at all costs, if the people do not have the truth then the lie is all they have to deal with.",,,Francisco,2,?
691,Townhall,"Seriously, Lady: PA Dem Who AG Barr Laughed At During That Clown Show Hea…",['2020/07/29'],709 comments,https://townhall.com/tipsheet/mattvespa/2020/07/29/pa-dem-who-ag-barr-laughed-at-during-clown-show-hearing-took-a-racial-swipe-at-hi-n2573366,DSMike,These congressional dog and pony shows are less than useless and even more so when run by the hate filled dems.  The media representation of these events is even worse.,,,,6,?
692,Townhall,Shocking: AP Reporter Embedded with Federal Officers in Portland Describes Ri…,['2020/07/28'],109 comments,https://townhall.com/tipsheet/guybenson/2020/07/28/shocking-ap-reporter-embedded-with-federal-officers-in-portland-describes-rioters-violent-attacks-n2573204,DSMike,lol...only in your leftist and inept dreams...,,,F-14 Tomcat,1,1
693,Townhall,Shocking: AP Reporter Embedded with Federal Officers in Portland Describes Ri…,['2020/07/28'],109 comments,https://townhall.com/tipsheet/guybenson/2020/07/28/shocking-ap-reporter-embedded-with-federal-officers-in-portland-describes-rioters-violent-attacks-n2573204,DSMike,"All doppler is pulsed moron, that is how you get the bounce back to track a moving target...if there is metal it absolutely can be tracked...are you really this stupid or do you work at it?",,,F-14 Tomcat,1,?
694,Townhall,Shocking: AP Reporter Embedded with Federal Officers in Portland Describes Ri…,['2020/07/28'],109 comments,https://townhall.com/tipsheet/guybenson/2020/07/28/shocking-ap-reporter-embedded-with-federal-officers-in-portland-describes-rioters-violent-attacks-n2573204,DSMike,"You whole charade has been whining, if you are incapable of seeing that then it is not my problem...and again your opinion matters not to me...I know my history and you know nothing so I am good.",,,F-14 Tomcat,1,1
695,Townhall,Shocking: AP Reporter Embedded with Federal Officers in Portland Describes Ri…,['2020/07/28'],109 comments,https://townhall.com/tipsheet/guybenson/2020/07/28/shocking-ap-reporter-embedded-with-federal-officers-in-portland-describes-rioters-violent-attacks-n2573204,DSMike,"OK, like I have said before, your opinion means nothing to me.  I come from a very long line of military service and my ego does not hinge on left wing whiners.",,,F-14 Tomcat,1,1
696,Townhall,Shocking: AP Reporter Embedded with Federal Officers in Portland Describes Ri…,['2020/07/28'],109 comments,https://townhall.com/tipsheet/guybenson/2020/07/28/shocking-ap-reporter-embedded-with-federal-officers-in-portland-describes-rioters-violent-attacks-n2573204,DSMike,"I can actually, served twenty years and most of it combat arms...but again I do not answer to subhuman leftist swine so not you.",,,F-14 Tomcat,1,1
697,Townhall,DC Teachers Line Up Body Bags to Protest School Reopening,['2020/07/29'],111 comments,https://townhall.com/tipsheet/madelinepeltzer/2020/07/29/dc-teachers-line-up-body-bags-to-protest-school-reopening-n2573377,DSMike,Those who do not show up get fired...easy.,,,,7,?
698,Townhall,BREAKING: Hong Kong Student Activists Arrested Under National Security Law,['2020/07/29'],120 comments,https://townhall.com/tipsheet/micaelaburrow/2020/07/29/breaking-hong-kong-student-activists-arrested-under-national-security-law-n2573383,DSMike,Disappeared...leftist tactics as born out by history.,,,,2,?
699,Townhall,Are We Really Shocked Rashida Tlaib Is Refusing to Endorse Biden?,['2020/07/29'],43 comments,https://townhall.com/tipsheet/mattvespa/2020/07/29/rashida-tlaib-refuses-to-endorse-biden-n2573315,DSMike,"COVID fatigue and no enthusiasm for their candidate will probably keep the leftists at home... we shall see however, will the orange man bad theme be the driving force?",,,,2,?
700,Townhall,"Monmouth GA Poll: Trump and Biden Tied, Loeffler and Perdue Lead in Senate Cont…",['2020/07/29'],52 comments,https://townhall.com/tipsheet/reaganmccarthy/2020/07/29/ga-poll-numbers-n2573376,DSMike,My guess...Georgia will fall GOP across the board polls do not pick up those who refuse to answer.,,,,0,0
701,Townhall,McConnell Accuses Pelosi of 'Sabotaging' Negotiations for the Next Stimulus Pack…,['2020/07/29'],91 comments,https://townhall.com/tipsheet/alexcorey/2020/07/29/mitch-mcconnell-makes-it-clear-he-wants-liability-protection-in-next-coronavirus-legislation-n2573362,DSMike,Negotiation and compromise...something the evil American left is incapable of accomplishing.,,,,6,?
