,Site Name,Article Name,Article Date,Total Article Comments,Article URL,Username,Comments,Responding to,Upvotes,Downvotes,Hate?,
64,The Gateway Pundit,“This Dude is Shooting at Us!” – BLM Militants Run For Their Lives After Milwa…,['2020/08'],1444 comments,https://www.thegatewaypundit.com/2020/08/dude-shooting-us-blm-militants-run-lives-milwaukee-homeowner-fires-warning-shots-protesters-neighborhood-video/,mike radant,Start killing the BLM/Antifa criminals from coast to coast! Hang the ones who survive!,,3,?,1,
65,The Gateway Pundit,Kenosha Riots Night 3: Law Enforcement Takes an Aggressive Offense on BLM Afte…,['2020/08'],245 comments,https://www.thegatewaypundit.com/2020/08/kenosha-riots-night-3-law-enforcement-takes-aggressive-offense-blm-police-declare-unlawful-assembly-video/,mike radant,(((They))) control the media and (((they))) have an agenda. (((They))) are also behind BLM and Antifa!,US_Auslander,22,1,2,
66,Breitbart News Network,"Black Lives Matter Protesters Heckle D.C. Diners, Chant: ‘White Silence Is Violence’",['2020/08/25'],354 comments,https://www.breitbart.com/politics/2020/08/25/black-lives-matter-protesters-heckle-d-c-diners-chant-white-silence-violence/,mike radant,"According to Dr Jim Willie  of the GoldenJackass.com, 70% of BLM members are white!",Sons of Liberty,5,?,2,?
67,Breitbart News Network,Watch: ‘Fox & Friends’ Cuts Away from Donna Brazile Meltdown — ‘You Cannot…,['2020/08/25'],5950 comments,https://www.breitbart.com/clips/2020/08/25/watch-fox-friends-cuts-away-from-donna-brazile-meltdown-you-cannot-erase-my-history/,mike radant,"I look forward to the post election temper tantrum by lefties, I have lots of ammo and have been shooting since the 1970's. They come in my area and I will have fun hunting the bastards, and lots of my redneck neighbors, too!",,1,?,1,
68,The Gateway Pundit,"AL GORE: If Trump Refuses to Concede, Military Will Take Him Out",['2020/08'],845 comments,https://www.thegatewaypundit.com/2020/08/al-gore-trump-refuses-concede-military-will-take/,mike radant,"With Pog-losi declaring Repubs criminals and traitors, BLM/Antifa agitation and riots and everything else going on, Demon-crats won't have to worry about Trump not getting elected!",,2,?,2,
69,The Gateway Pundit,Democrat Leader Talcum X Calls for More Violenct and Complete Dismantling on U…,['2020/08'],540 comments,https://www.thegatewaypundit.com/2020/08/democrat-leader-talcum-x-calls-violenct-complete-dismantling-us-police/,mike radant,What we really need is an all out race war to remove the black plague the USA is suffering from!,,2,1,1,
70,Vidmax,ANTIFA Chick Learns About Gender Equality When She Punches Back The Bl…,[],100 comments,https://vidmax.com/video/197872-antifa-chick-learns-about-gender-equality-when-she-punches-back-the-blue-supporter-gets-ktfo,mike radant,Too bad it was only one Antifa bytch! We need to start shooting and killing all BLM/Antifa criminals!,,0,0,1,
71,The Gateway Pundit,"Chicago BLM Militant Issues Threat: ""We Have Demands and They Need to Be Met.…",['2020/08'],816 comments,https://www.thegatewaypundit.com/2020/08/chicago-blm-militant-issues-threat-demands-need-met-can-listen-us-get-ran-video/,mike radant,We need an all out race war! THEY need to be extinct!,,1,?,1,
72,The Gateway Pundit,80-Year-Old Grandfather Dies After Brutal Beating and Robbery in Grocery Store Ba…,['2020/08'],399 comments,https://www.thegatewaypundit.com/2020/08/family-80-year-old-died-beaten-robbed-grocery-store-bathroom-seeks-justice/,mike radant,"We're supposed to believe the ""equality"" BS the (((media))) is pushing, but black crime/hate crimes are skyrocketing. The race war is coming!",,6,?,1,
73,The Gateway Pundit,WATCH: Violence Breaks Out as Conservatives Refuse to Back Down Fro…,['2020/08'],401 comments,https://www.thegatewaypundit.com/2020/08/watch-violence-breaks-conservatives-refuse-back-black-lives-matter-mob-beverly-hills/,mike radant,"They need to declare BLM/Antifa terrorist groups, go after their funding and start using real bullets if they riot! Lock the survivors up for a couple decades!",,6,?,2,
74,WND,San Francisco needs to admit it was wrong on vaping,['2020/08'],5 comments,https://www.wnd.com/2020/08/san-francisco-needs-admit-wrong-vaping/,mike radant,"The sooner SoCal is destroyed, the better!",,0,0,1,?
75,WND,Gang of teens accused of robbery and murder of N.C. girl – media silent,['2020/08'],35 comments,https://www.wnd.com/2020/08/gang-teens-accused-robbery-murder-n-c-girl-media-silent/,mike radant,"We know (((who))) controls the media and has an agenda. If it is black on white crime, no coverage, If it is white on black crime, national coverage. If it is black on (((them))), it is a new Holocaust! (((They))) are also behind BLM and Antifa!",,1,?,2,
76,WND,Gang of teens accused of robbery and murder of N.C. girl – media silent,['2020/08'],35 comments,https://www.wnd.com/2020/08/gang-teens-accused-robbery-murder-n-c-girl-media-silent/,mike radant,"Or ""youths!""",Viet Nam Vet,1,?,0,
77,Breitbart News Network,LeBron James on Reading Malcolm X Autobiography: ‘It’s Him Understanding…,['2020/08/21'],815 comments,https://www.breitbart.com/sports/2020/08/21/lebron-james-on-reading-malcolm-x-autobiography-its-him-understanding-how-powerful-the-negro-can-be/,mike radant,“The United States has become a place where entertainers and professional athletes are mistaken for people of importance.” —Robert A. Heinlein,,0,0,2,
78,Breitbart News Network,"Donald Trump: Joe Biden Is ‘More Likable,’ but Hillary Clinton Is ‘Much Smarter’",['2020/08/22'],1982 comments,https://www.breitbart.com/politics/2020/08/22/donald-trump-joe-biden-more-likable-hillary-clinton-much-smarter/,mike radant,And they're both senile!,,0,0,2,
79,WND,Mexico's Jalisco cartel adopts new tactic: Drones armed with C-4 explosive,['2020/08'],10 comments,https://www.wnd.com/2020/08/mexicos-jalisco-cartel-adopts-new-tactic-drones-armed-c-4-explosive/,mike radant,Sounds like a good weapon against BLM and Antifa!,,1,2,2,
80,WND,Feds open probe of university that punished student for image with gun,['2020/08'],156 comments,https://www.wnd.com/2020/08/feds-open-probe-university-punished-student-image-gun/,mike radant,Get the best shyster you can find and sue everyone down to the cleaning lady!,,2,1,2,
81,Breitbart News Network,Elizabeth Warren Calls for the Firing of Postmaster General Louis DeJoy,['2020/08/22'],539 comments,https://www.breitbart.com/politics/2020/08/22/elizabeth-warren-calls-for-the-firing-of-postmaster-general-louis-dejoy/,mike radant,"Takes one to know one, big mouth f@ggot!",Sam Stegelski,1,?,1,
82,InvestmentWatchBlog,"NYC Is Dying Due To Corrupt Democrats, DeBlasio Siphons $2M To His Wife While…",[],1 comments,https://www.investmentwatchblog.com/nyc-is-dying-due-to-corrupt-democrats-deblasio-siphons-2m-to-his-wife-while-planning-22k-layoffs/,mike radant,What about the missing $850 million DeBlahBlah's wife siphoned off from ThriveNYC?https://www.dailymail.co.uk...,,0,0,2,
83,InvestmentWatchBlog,BLACK CHICAGO RESIDENTS want federal troops sent in as Mayor lets the city desc…,[],2 comments,https://www.investmentwatchblog.com/black-chicago-residents-want-federal-troops-sent-in-as-mayor-lets-the-city-descend-into-a-warzone/,mike radant,"This is what  you get for letting stupid people vote who breed like rats instead of the intelligent, thoughtful people. Would anyone in their right mind vote Lightweight or DeBlahBlah into office?!?",,1,?,2,
84,WND,Sociology professor: 'Fat-phobia is rooted in anti-blackness',['2020/08'],122 comments,https://www.wnd.com/2020/08/sociology-professor-fat-phobia-rooted-anti-blackness/,mike radant,"So, not having a heart attack is racist?!? Damn. Proof you can be educated past your intelligence level!",,4,?,2,
85,WND,"Cher wants to save Post Office by volunteering, but no one will help her",['2020/08'],11 comments,https://www.wnd.com/2020/08/cher-wants-save-post-office-volunteering-no-one-will-help/,mike radant,Is she three digits old or is it four digits?!?,,0,0,2,?
86,WND,Catholic priest closes DNC by praying for 'the unborn child in the womb',['2020/08'],94 comments,https://www.wnd.com/2020/08/catholic-priest-closes-dnc-praying-unborn-child-womb/,mike radant,I bet the liberal demons in the crowd screamed in anguish!,,2,?,2,
87,WND,Dem convention showed the real reason D.C. hates Trump,['2020/08'],119 comments,https://www.wnd.com/2020/08/dem-convention-showed-real-reason-d-c-hates-trump/,mike radant,The same (((people))) who control the ((media))) have an agenda and control BLM/Antifa!,,4,?,2,
88,WND,Mom says parents asked to sign 'ridiculous' waiver they won't eavesdro…,['2020/08'],30 comments,https://www.wnd.com/2020/08/mom-says-parents-asked-sign-ridiculous-waiver-wont-eavesdrop-kids-online-lessons/,mike radant,"Can't mention God, but you can have sodomites, lesbians, trannies, commies, etc... come in and propagandize them!",General Robert E. Lee,5,?,1,
89,WND,Mom says parents asked to sign 'ridiculous' waiver they won't eavesdro…,['2020/08'],30 comments,https://www.wnd.com/2020/08/mom-says-parents-asked-sign-ridiculous-waiver-wont-eavesdrop-kids-online-lessons/,mike radant,"A perfect argument for home schooling vs public school indoctrination! There are some very good online resources for home schooling, the main thing is you have to have an education yourself. And partner with like minded people in your area so you get some backup and your kids socialize.",,0,0,0,
90,WND,"Woman who stole 7-year-old boy's MAGA hat, harassed his mother arrested",['2020/08'],122 comments,https://www.wnd.com/2020/08/woman-stole-7-year-old-boys-maga-hat-harassed-mother-arrested/,mike radant,Most liberals are deranged enough without Trump!,Frank from Iowa,4,?,2,
91,WND,"Woman who stole 7-year-old boy's MAGA hat, harassed his mother arrested",['2020/08'],122 comments,https://www.wnd.com/2020/08/woman-stole-7-year-old-boys-maga-hat-harassed-mother-arrested/,mike radant,"The mother was stupid to bring a kid to that place, but they had no right to attack them. Hope both of them see some jail time! They're even more lucky the mother didn't have a gun!",,1,2,2,
92,WND,Sociology professor: 'Fat-phobia is rooted in anti-blackness',['2020/08'],122 comments,https://www.wnd.com/2020/08/sociology-professor-fat-phobia-rooted-anti-blackness/,mike radant,“Some ideas are so stupid that only intellectuals believe them.”--George Orwell,,15,?,0,
93,WND,Joe Biden vows end of national 'darkness' in convention finale,['2020/08'],77 comments,https://www.wnd.com/2020/08/joe-biden-vows-end-national-darkness-convention-finale/,mike radant,That's because they belong to (((The Satanic Tribe)))!,RioSul50 .,0,0,2,
94,WND,Joe Biden vows end of national 'darkness' in convention finale,['2020/08'],77 comments,https://www.wnd.com/2020/08/joe-biden-vows-end-national-darkness-convention-finale/,mike radant,Decades of Jew media/white guilt conditioning!,Tomas Cruz,0,0,1,?
95,WND,Joe Biden vows end of national 'darkness' in convention finale,['2020/08'],77 comments,https://www.wnd.com/2020/08/joe-biden-vows-end-national-darkness-convention-finale/,mike radant,"Go into the light, Joe. Go into the light!",,1,?,0,
96,Vidmax,Guy Cheers On Two Women Beating The Snot Out Of Each Other While Holding A…,[],21 comments,https://vidmax.com/video/197843-guy-cheers-on-two-women-beating-the-snot-out-of-each-other-while-holding-a-baby-wait-for-it,mike radant,We need an all out race war!,,1,2,1,
97,WND,Was the cop's knee on George Floyd's neck 'racism'? No,['2020/08'],15 comments,https://www.wnd.com/2020/08/cops-knee-george-floyds-neck-racism-no/,mike radant,He got what his kind deserves!,,1,?,1,
98,WND,Portland protester who kicked man unconscious begs for money,['2020/08'],35 comments,https://www.wnd.com/2020/08/portland-protester-kicke-man-unconscious-begs-money/,mike radant,Bet he doesn't last long in the Big House!,,1,?,2,
99,WND,Officer makes shocking comment about 5-year-old white boy executed by black man,['2020/08'],584 comments,https://www.wnd.com/2020/08/officer-makes-shocking-comment-5-year-old-white-boy-executed-black-man/,mike radant,"It just goes to show, the USA needs an all out race war!",,4,3,1,
100,WND,Officer makes shocking comment about 5-year-old white boy executed by black man,['2020/08'],584 comments,https://www.wnd.com/2020/08/officer-makes-shocking-comment-5-year-old-white-boy-executed-black-man/,mike radant,Liberals = Jews,Frank from Iowa,5,?,1,?
101,WND,Officer makes shocking comment about 5-year-old white boy executed by black man,['2020/08'],584 comments,https://www.wnd.com/2020/08/officer-makes-shocking-comment-5-year-old-white-boy-executed-black-man/,mike radant,"I must humbly disagree, they are also useful for body parts for humans!",.454casull,2,?,0,
102,WND,Scientists capture first male murder hornet,['2020/08'],105 comments,https://www.wnd.com/2020/08/scientists-capture-first-male-murder-hornet/,mike radant,"Can we send them to Seattle, Portland, Frisco, etc...?!?",,5,?,0,
103,KCETLink,"Before the 1950s, the Whiteness of Compton was Defended Vehemently",[],3 comments,http://www.kcet.org/socal-focus/before-the-1950s-the-whiteness-of-compton-was-defended-vehemently,mike radant,What the USA really needs is an all out race war!,,0,0,1,
104,WND,"School assignment depicts police as slave owners, KKK",['2020/08'],344 comments,https://www.wnd.com/2020/08/school-assignment-depicts-police-slave-owners-kkk/,mike radant,First thing we need to do is abolish the Department of (Mis)Education!,Goatroper2211,13,?,2,
105,WND,"School assignment depicts police as slave owners, KKK",['2020/08'],344 comments,https://www.wnd.com/2020/08/school-assignment-depicts-police-slave-owners-kkk/,mike radant,"They say half the 4000 liberal arts colleges in the USA will close in the next 5-10 years, GOOD! Most of them are just Marxist, Communist indoctrination someone else mentioned that is going on in public schools. College now is just overpriced indoctrination for the same thing!",,10,?,2,
106,WND,"Over 100,000 Chinese evacuated as floods continue pressuring Three Gorges Dam",['2020/08/10'],12 comments,https://www.wnd.com/2020/08/100000-chinese-evacuated-floods-continue-pressuring-three-gorges-dam/,mike radant,"Chinese  have been waging low level war on the USA for a long time. Trump was the only one who put a stop to the spying, intellectual and technology theft, manufacturing of drugs like Fentynal and shipping them to the USA. Not to mention (as we're finding now) arming below the border, huge people smuggling rings and even thousands of weapons to BLM/Antifa and fake ID's, etc... Let China crash and burn and let them suffer!",,1,?,2,
107,WND,Officer makes shocking comment about 5-year-old white boy executed by black man,['2020/08'],584 comments,https://www.wnd.com/2020/08/officer-makes-shocking-comment-5-year-old-white-boy-executed-black-man/,mike radant,"Black kids dying is a symptom, and also shows that we don't need them in this country. But it's great that they're killing each other!",Stathanacious1952,0,0,1,
108,WND,Officer makes shocking comment about 5-year-old white boy executed by black man,['2020/08'],584 comments,https://www.wnd.com/2020/08/officer-makes-shocking-comment-5-year-old-white-boy-executed-black-man/,mike radant,"Jews control the media, Jews control BLM/Antifa, Jews are behind communism, liberalism, socialism, women's lib, etc... See a pattern here?!?",Fenderman52,1,?,1,
109,WND,Officer makes shocking comment about 5-year-old white boy executed by black man,['2020/08'],584 comments,https://www.wnd.com/2020/08/officer-makes-shocking-comment-5-year-old-white-boy-executed-black-man/,mike radant,There is always a ((('human rights' lawyer))) waiting to help the murderer or terrorist with a mental impairment deference. Its a fake defence!,anonymous scribe,1,?,2,
110,WND,Officer makes shocking comment about 5-year-old white boy executed by black man,['2020/08'],584 comments,https://www.wnd.com/2020/08/officer-makes-shocking-comment-5-year-old-white-boy-executed-black-man/,mike radant,"We're already in a race war, stupid. Black on white crime is out of control and of course the (((media))) ignores it, If someone white said this about a black kid, all hell would break out. When the race war comes, it will be everyone against blacks!",I. C. Rhodes,0,0,1,
111,WND,Officer makes shocking comment about 5-year-old white boy executed by black man,['2020/08'],584 comments,https://www.wnd.com/2020/08/officer-makes-shocking-comment-5-year-old-white-boy-executed-black-man/,mike radant,"We really, really need an all out race war to remove this infestation!",,1,3,1,
112,https://www.campusreform.org,Duke prof proposes $12 trillion in reparations....$800k per eligible Black h…,[],37 comments,https://www.campusreform.org/?ID=15473&,mike radant,How about an all out race war to remove the black infestation of the USA!,,1,?,1,
113,WND,"Girl says governor grabbed her butt, governor denies 'disgraceful' claim",['2020/08'],188 comments,https://www.wnd.com/2020/08/girl-says-governor-grabbed-butt-governor-denies-disgraceful-claim/,mike radant,The young woman says she forgot about the incident until she saw Bullock running for the Democratic presidential nomination..............That says it all!,,2,?,0,
114,WND,Hillary blocks unapproved people from commenting on Bill Clinton post,['2020/08'],19 comments,https://www.wnd.com/2020/08/hillary-clinton-blocks-unapproved-people-commenting-bill-clinton-post/,mike radant,"Why bother to block them, Hillary would just have them killed!",,3,?,2,
115,The Hill,Stacey Abrams leads chorus in Dem keynote address,[],174 comments,https://thehill.com/homenews/campaign/512637-stacey-abrams-leads-chorus-in-dem-keynote-address,mike radant,Wow! What a comeback!,jeff bringenberg,0,0,0,
116,The Hill,Stacey Abrams leads chorus in Dem keynote address,[],174 comments,https://thehill.com/homenews/campaign/512637-stacey-abrams-leads-chorus-in-dem-keynote-address,mike radant,If Mike Tyson became a sex change operation and gained 400 lbs...........,,4,?,2,?
117,The Hill,Stacey Abrams leads chorus in Dem keynote address,[],174 comments,https://thehill.com/homenews/campaign/512637-stacey-abrams-leads-chorus-in-dem-keynote-address,mike radant,"Like you did, @sshole!",mediakitty,1,1,2,
118,The Hill,Stacey Abrams leads chorus in Dem keynote address,[],174 comments,https://thehill.com/homenews/campaign/512637-stacey-abrams-leads-chorus-in-dem-keynote-address,mike radant,The only thing that fat ho is running for is the buffet line!,,4,1,2,
119,The Hill,Black women are ambitious — that's why we need more in office,[],520 comments,https://thehill.com/opinion/civil-rights/511385-black-women-are-ambitious-thats-why-we-need-more-in-office,mike radant,Hear she's pretty good when she's on her knees!,HA,1,?,2,
120,The Hill,Black women are ambitious — that's why we need more in office,[],520 comments,https://thehill.com/opinion/civil-rights/511385-black-women-are-ambitious-thats-why-we-need-more-in-office,mike radant,Sleepy Joe & Kamel Toe In 2020,,0,0,2,
121,The Hill,Clinton tears into Trump over COVID-19 response in convention speech,[],1543 comments,https://thehill.com/homenews/campaign/512635-clinton-tears-into-trump-over-covid-19-response-in-convention-speech,mike radant,Funny Bill Clinton talking about how many were killed!,,1,1,2,
122,The Hill,Clinton tears into Trump over COVID-19 response in convention speech,[],1543 comments,https://thehill.com/homenews/campaign/512635-clinton-tears-into-trump-over-covid-19-response-in-convention-speech,mike radant,Like the female members of your family?,Telford_Taylor,2,?,0,
123,The Hill,Clinton tears into Trump over COVID-19 response in convention speech,[],1543 comments,https://thehill.com/homenews/campaign/512635-clinton-tears-into-trump-over-covid-19-response-in-convention-speech,mike radant,I wonder how many Bill killed on Pedo Island?!?,🦠 trump* spreads virus 🦠,1,?,2,
124,The Hill,Clinton tears into Trump over COVID-19 response in convention speech,[],1543 comments,https://thehill.com/homenews/campaign/512635-clinton-tears-into-trump-over-covid-19-response-in-convention-speech,mike radant,Old Rapist Bill has killed more than Corona Virus ever has!,,1,2,2,
125,The Hill,Democrats officially nominate Biden for president,[],4258 comments,https://thehill.com/homenews/campaign/512574-democrats-officially-nominate-biden-for-president,mike radant,Sleepy Joe & Kamel Toe In 2020,,2,1,2,
126,The Hill,Democrats officially nominate Biden for president,[],4258 comments,https://thehill.com/homenews/campaign/512574-democrats-officially-nominate-biden-for-president,mike radant,"It's going to be fun watching Trump win in November and watching the Demo's blow all the capillaries in their tiny brains and the ensuing temper tantrum. Got guns and lots of ammo, and am ready to go BLM/Antifa hunting!",,1,?,1,
127,The Hill,Harris looks to complete Biden path to presidency,[],6600 comments,https://thehill.com/homenews/senate/512011-harris-looks-to-complete-biden-path-to-presidency,mike radant,Dickhead Democrats like you aren't,baffledbyyourignorance,0,0,2,
128,The Hill,Harris looks to complete Biden path to presidency,[],6600 comments,https://thehill.com/homenews/senate/512011-harris-looks-to-complete-biden-path-to-presidency,mike radant,Doesn't have much perspective from her knees!,,1,?,2,
129,The Hill,Harris looks to complete Biden path to presidency,[],6600 comments,https://thehill.com/homenews/senate/512011-harris-looks-to-complete-biden-path-to-presidency,mike radant,"And she will get on her knees to do it, just like she did in California!",,0,0,2,
130,The Hill,Riot declared in Portland,[],2621 comments,https://thehill.com/homenews/state-watch/512233-riot-declared-in-portland,mike radant,"Come to my neck of the country and see if you walk away. Some idiots like you went to Sturgis and the only reason they lived was the cops they insult and defund protected them and took them away. Outside the blue, f#cked up blue, liberal cities, won't survive!We would love to have you visit!",steviethunder9,0,0,2,
131,The Hill,Riot declared in Portland,[],2621 comments,https://thehill.com/homenews/state-watch/512233-riot-declared-in-portland,mike radant,"It has nothing to do with the 1st Amendment, ignorant @sshole. They are criminals, plain and simple. You can call me, and we can arrange to meet! (870) 427-2819",Gordo Oso,0,0,2,
132,The Hill,Riot declared in Portland,[],2621 comments,https://thehill.com/homenews/state-watch/512233-riot-declared-in-portland,mike radant,"(870) 427-2819 Give me a call, bigmouth!",Gordo Oso,0,0,2,
133,The Hill,Riot declared in Portland,[],2621 comments,https://thehill.com/homenews/state-watch/512233-riot-declared-in-portland,mike radant,You seem stupid!,Gordo Oso,0,0,2,
134,The Hill,Riot declared in Portland,[],2621 comments,https://thehill.com/homenews/state-watch/512233-riot-declared-in-portland,mike radant,You seem stupid!,Gordo Oso,0,0,2,
135,The Hill,Riot declared in Portland,[],2621 comments,https://thehill.com/homenews/state-watch/512233-riot-declared-in-portland,mike radant,Where did you get these figures? A comic book. BLM/Antifa are terrorists and criminals and need to be treated as such!,New Tech Investor,9,1,2,
136,The Hill,Riot declared in Portland,[],2621 comments,https://thehill.com/homenews/state-watch/512233-riot-declared-in-portland,mike radant,"LOL! They are criminals that has nothing to do with 1st Amendment rights. Your mom & dad are cousins, aren't they?!?",Gordo Oso,0,0,2,
137,The Hill,Trump 'failure' on COVID-19 will be central message of Biden convention,[],6139 comments,https://thehill.com/homenews/campaign/511851-trump-failure-on-covid-19-will-be-central-message-of-biden-convention,mike radant,Biden can barely remember his name. Even Bath House Barry doubts he will make it in office.,,0,0,2,
138,The Hill,The Space Force moves to define itself and its mission,[],525 comments,https://thehill.com/opinion/technology/512210-the-space-force-moves-to-define-itself-and-its-mission,mike radant,They don't contact us because of their superior intelligence!,Jeff9011,0,0,0,
139,The Hill,The Space Force moves to define itself and its mission,[],525 comments,https://thehill.com/opinion/technology/512210-the-space-force-moves-to-define-itself-and-its-mission,mike radant,"Come on, they have the technology decades ahead of what they release to the public. They have a mission and tech, they're just now revealing it to us.",,0,0,0,
140,The Hill,The Space Force moves to define itself and its mission,[],525 comments,https://thehill.com/opinion/technology/512210-the-space-force-moves-to-define-itself-and-its-mission,mike radant,And the best way to kill BLM/Antifa vermin!,Peter G,1,?,1,
141,The Hill,Clyburn: Trump 'signing a death warrant for a lot of people' with mail-in voting o…,[],1322 comments,https://thehill.com/homenews/house/512207-clyburn-trump-signing-a-death-warrant-for-a-lot-of-people-with-mail-in-voting,mike radant,Another nig liar!,,0,0,1,
142,The Hill,Clyburn: Trump 'signing a death warrant for a lot of people' with mail-in voting o…,[],1322 comments,https://thehill.com/homenews/house/512207-clyburn-trump-signing-a-death-warrant-for-a-lot-of-people-with-mail-in-voting,mike radant,Like your mom!,Fluke Slayer,0,0,2,
143,The Hill,November will decide the fate of economic bailouts in blue states,[],1142 comments,https://thehill.com/opinion/campaign/512256-november-will-decide-the-fate-of-economic-bailouts-in-blue-states,mike radant,"No, a good indicator is how many blowjobs your wife and mom give!",King Con Trump,0,0,2,
