,Site Name,Article Name,Article Date,Total Article Comments,Article URL,Username,Comments,Hate?,Flag ???,Responding to,Upvotes,Downvotes
1142,Twitchy,"Over 2 weeks ago, South Dakota Gov. Kristi Noem was criticized for not issuing a sta…",['2020/04/30'],156 comments,https://twitchy.com/gregp-3534/2020/04/30/over-2-weeks-ago-south-dakota-gov-kristi-noem-was-criticized-for-not-issuing-a-stay-at-home-order-lets-check-in-on-the-state-shall-we/,NDPACKER,Killing people is more than a hobby to democrats.,,,MTHarpooner,3,?
1143,Twitchy,"Over 2 weeks ago, South Dakota Gov. Kristi Noem was criticized for not issuing a sta…",['2020/04/30'],156 comments,https://twitchy.com/gregp-3534/2020/04/30/over-2-weeks-ago-south-dakota-gov-kristi-noem-was-criticized-for-not-issuing-a-stay-at-home-order-lets-check-in-on-the-state-shall-we/,NDPACKER,NDs governor is doing ok.,,,Crakalakin,6,?
1144,Twitchy,"Over 2 weeks ago, South Dakota Gov. Kristi Noem was criticized for not issuing a sta…",['2020/04/30'],156 comments,https://twitchy.com/gregp-3534/2020/04/30/over-2-weeks-ago-south-dakota-gov-kristi-noem-was-criticized-for-not-issuing-a-stay-at-home-order-lets-check-in-on-the-state-shall-we/,NDPACKER,All members of the main stream media lie all the time.All democrats lie all the time.All communists lie all the time.See the pattern here?,,,r t,13,?
1145,Townhall,WATCH: Illinois Gov Asked If His Wife Violated State's 'Stay-at-Home' Order By…,['2020/04/30'],82 comments,https://townhall.com/tipsheet/juliorosas/2020/04/30/watch-illinois-gov-asked-if-his-wife-violated-states-stayathome-order-by-traveling-to-florida-n2567914,NDPACKER,He is just one more corrupt democrat in a long line of corrupt Illinois democrats.,,,Barbara,14,?
1146,Townhall,So Cuomo Is Finally Getting Around to Cleaning the Subways...,['2020/04/30'],279 comments,https://townhall.com/tipsheet/cortneyobrien/2020/04/30/so-cuomo-is-finally-getting-around-to-cleaning-the-subways-n2567899,NDPACKER,Actually it is because they want to kill their constituents.,,,PigressivesSuck,3,?
1147,Townhall,Facepalm: Former ESPN Writer Says Patriots NFL Draft Pick Is a White Supre…,['2020/04/29'],532 comments,https://townhall.com/tipsheet/mattvespa/2020/04/29/facepalm-former-espn-writer-says-patriots-nfl-draft-pick-is-a-white-supremacist-n2567674,NDPACKER,Jemele Hill is the most racist monkey on the planet.,,,,3,?
1148,Twitchy,‘Totalitarian garbage’: Video shows officers giving Wisconsin mom a warning…,['2020/04/29'],300 comments,https://twitchy.com/dougp-3137/2020/04/29/totalitarian-garbage-video-shows-officers-giving-wisconsin-mom-a-warning-for-allowing-daughter-to-play-at-neighbors-house-during-stay-at-home-order/,NDPACKER,I used to support all cops everywhere.  No more.  When one dies I will toast the Nazis death.,,,Conserve Truth,3,3
1149,Twitchy,‘Good thing people don’t need those’! NY Gov. Andrew Cuomo shows off ‘PR collag…,['2020/04/29'],111 comments,https://twitchy.com/dougp-3137/2020/04/29/good-thing-people-dont-need-those-ny-gov-andrew-cuomo-shows-off-pr-collage-made-from-thousands-of-donated-masks/,NDPACKER,Cuomo collected the masks from all the people he killed because of his incompetence.,,,,0,0
1150,Townhall,Chris Cuomo Denies He Was Sick When Breaking Quarantine — But That's Not W…,['2020/04/29'],78 comments,https://townhall.com/tipsheet/juliorosas/2020/04/29/chris-cuomo-denies-breaking-quarantine--but-thats-not-what-cnn-or-his-wife-said-n2567854,NDPACKER,You define megasuccessful as being a paid liar for the democrats?  Really?  WTF?,,,Tom Boye,1,?
1151,Townhall,Chris Cuomo Denies He Was Sick When Breaking Quarantine — But That's Not W…,['2020/04/29'],78 comments,https://townhall.com/tipsheet/juliorosas/2020/04/29/chris-cuomo-denies-breaking-quarantine--but-thats-not-what-cnn-or-his-wife-said-n2567854,NDPACKER,Get in the boat Fredo.,,,Lillian DeVore,4,?
1152,Twitchy,FACT CHECK: Univ. of Texas law professor explains what’s really going on with Pres…,['2020/04/29'],133 comments,https://twitchy.com/gregp-3534/2020/04/29/fact-check-univ-of-texas-law-professor-explains-whats-really-going-on-with-president-trumps-eo-on-meat-processing-plants/,NDPACKER,We know all members of the main stream media are enemies of America and all Americans.  When are we going to stand up and do something about it?,,,,3,?
1153,Townhall,AZ Woman Who Blamed Trump for Chloroquine Ingestion Now Subject of H…,['2020/04/29'],741 comments,https://townhall.com/tipsheet/mattvespa/2020/04/29/az-woman-who-blamed-trump-for-chloroquine-ingestion-now-subject-of-homicide-inves-n2567839,NDPACKER,I thought she was going to be Sleepy Joe's running mate.,,,Count Floyd,1,?
1154,Twitchy,"NYC needs to open up its economy, and fast, before Mayor de Blasio’s CREEPY fin…",['2020/04/29'],84 comments,https://twitchy.com/gregp-3534/2020/04/29/nyc-needs-to-open-up-its-economy-and-fast-before-mayor-de-blasios-creepy-fingernails-get-any-longer-photo/,NDPACKER,I always knew he was a drag queen.,,,surfdog,1,?
1155,Townhall,Guess Which 'Never Trumper' Is Running for the Libertarian Party Nomination,['2020/04/28'],451 comments,https://townhall.com/tipsheet/bethbaumann/2020/04/28/guess-which-never-trumper-is-running-for-the-libertarian-party-nomination-n2567831,NDPACKER,Justin Amash is a coward and a traitor and should be ignored.,,,coolercoleman,8,?
1156,Twitchy,AOC’s solution to workers earning more in unemployment benefits than while work…,['2020/04/28'],34 comments,https://twitchy.com/sarahd-313035/2020/04/28/aocs-solution-to-workers-earning-more-in-unemployment-benefits-than-while-working-is-predictably-embarrassing/,NDPACKER,Forgive her.  She has Stage V TDS.  Her brain no longer functions.,,,Auwtsnae,3,?
1157,Twitchy,‘She believes everyone is beneath her’: Steve Krakauer SHREDS Soledad O’Brien…,['2020/04/28'],56 comments,https://twitchy.com/samj-3930/2020/04/28/she-believes-everyone-is-beneath-her-steve-krakauer-shreds-soledad-obrien-and-her-flying-monkeys-just-cant-deal/,NDPACKER,Soledad O’Brien suffers from Stage IV TDS.  Her brain is now melting in her head.MAGA!,,,,3,?
1158,Twitchy,‘She believes everyone is beneath her’: Steve Krakauer SHREDS Soledad O’Brien…,['2020/04/28'],56 comments,https://twitchy.com/samj-3930/2020/04/28/she-believes-everyone-is-beneath-her-steve-krakauer-shreds-soledad-obrien-and-her-flying-monkeys-just-cant-deal/,NDPACKER,That was never.,,,Dick_Gosinya,2,?
1159,Twitchy,‘She believes everyone is beneath her’: Steve Krakauer SHREDS Soledad O’Brien…,['2020/04/28'],56 comments,https://twitchy.com/samj-3930/2020/04/28/she-believes-everyone-is-beneath-her-steve-krakauer-shreds-soledad-obrien-and-her-flying-monkeys-just-cant-deal/,NDPACKER,First sane post on this story.,,,Mr. Creosote,1,?
1160,Twitchy,‘She believes everyone is beneath her’: Steve Krakauer SHREDS Soledad O’Brien…,['2020/04/28'],56 comments,https://twitchy.com/samj-3930/2020/04/28/she-believes-everyone-is-beneath-her-steve-krakauer-shreds-soledad-obrien-and-her-flying-monkeys-just-cant-deal/,NDPACKER,That was never too.,,,Name,0,0
1161,Twitchy,Blue-checked Rutgers associate professor reveals that the ‘utterly absurd push to r…,['2020/04/28'],118 comments,https://twitchy.com/sarahd-313035/2020/04/28/blue-checked-rutgers-associate-professor-reveals-that-the-utterly-absurd-push-to-re-open-the-country-is-all-about-killing-more-black-people/,NDPACKER,This is what happens when TDS goes untreated.  Eventually it cannibalizes the brain.,,,Name,5,?
1162,Twitchy,President Trump tells the press to let Sleepy Joe Biden know he’s not thinking…,['2020/04/27'],64 comments,https://twitchy.com/brettt-3136/2020/04/27/president-trump-tells-the-press-to-let-sleepy-joe-biden-know-hes-not-thinking-about-delaying-the-election-at-all/,NDPACKER,"Nervous, Joe?",,,,0,0
1163,The Daily Wire,"WATCH: Teacher Yells At Teenagers Playing Football, ‘I Hope You Get The Coronaviru…",[],285 comments,https://www.dailywire.com/news/watch-teacher-yells-at-teenagers-playing-football-i-hope-you-get-the-coronavirus-die-a-long-painful-death,NDPACKER,The good people of New Jersey should not wait for the virus to kill  Nicole Griggs.  Just sayin'.,,,,0,0
1164,Townhall,Local News Outlet Asks Elise Stefanik Ridiculous Question About China,['2020/04/27'],279 comments,https://townhall.com/tipsheet/cortneyobrien/2020/04/27/local-news-outlet-asks-elise-stefanik-ridiculous-question-about-china-n2567684,NDPACKER,Ours have been okay until a few months ago.,,,angry american,1,?
1165,Townhall,Local News Outlet Asks Elise Stefanik Ridiculous Question About China,['2020/04/27'],279 comments,https://townhall.com/tipsheet/cortneyobrien/2020/04/27/local-news-outlet-asks-elise-stefanik-ridiculous-question-about-china-n2567684,NDPACKER,Our local news outlets are actually reporting more fake news than the main stream media.  KFYR-TV in Bismarck has a communist propagandist by the name of Jacob Notermann that is truly an enemy of the American people and should be given an Arkansas necktie.,,,,10,?
1166,Townhall,"Pelosi: You Know, Trump’s Travel Ban Didn’t Go Far Enough",['2020/04/26'],678 comments,https://townhall.com/tipsheet/bethbaumann/2020/04/26/pelosi-you-know-trumps-travel-ban-didnt-go-far-enough-n2567639,NDPACKER,"So, so ignorant.  The Arkansas shuffle is when Bill and Hillary had someone murdered.",,,Kenneth Cooper,0,0
1167,Townhall,"Pelosi: You Know, Trump’s Travel Ban Didn’t Go Far Enough",['2020/04/26'],678 comments,https://townhall.com/tipsheet/bethbaumann/2020/04/26/pelosi-you-know-trumps-travel-ban-didnt-go-far-enough-n2567639,NDPACKER,You should sober up and accept the facts.  She is senile.,,,thefireman,2,?
1168,Townhall,"Pelosi: You Know, Trump’s Travel Ban Didn’t Go Far Enough",['2020/04/26'],678 comments,https://townhall.com/tipsheet/bethbaumann/2020/04/26/pelosi-you-know-trumps-travel-ban-didnt-go-far-enough-n2567639,NDPACKER,Doe your mom ever complain about all of your screaming coming from her basement?,,,Bill,2,?
1169,Townhall,"Pelosi: You Know, Trump’s Travel Ban Didn’t Go Far Enough",['2020/04/26'],678 comments,https://townhall.com/tipsheet/bethbaumann/2020/04/26/pelosi-you-know-trumps-travel-ban-didnt-go-far-enough-n2567639,NDPACKER,"Nancy Pelosi is a lying, senile elder democrat that needs to be ignored, voted out of office, or retired via the Arkansas shuffle.",,,Maitaikovsky,32,1
1170,Townhall,The Consequences of New York State's Dangerous Nursing Home Directive,['2020/04/27'],195 comments,https://townhall.com/tipsheet/cortneyobrien/2020/04/27/new-york-states-dangerous-nursing-home-directive-n2567612,NDPACKER,"Cuomo should be charged with capital murder, tried, found guilty, stood up against a wall and shot.  He is a filthy democrat responsible for ALL of the deaths in his state.",,,Joe Biden,2,?
1171,Townhall,One of the Dems' Most Influential Political Operatives Is Under Investigation,['2020/04/26'],334 comments,https://townhall.com/tipsheet/bethbaumann/2020/04/26/one-of-the-dems-most-influential-political-operatives-is-under-investigation-n2567631,NDPACKER,David Brock is an enemy of the American people.  LOCK HIM UP!,,,Go_FreeMarkets,1,?
1172,Townhall,Shifty Schiff: Thousands of Americans Are Dead Because We Didn't Successfully Im…,['2020/04/25'],787 comments,https://townhall.com/tipsheet/bethbaumann/2020/04/25/shifty-schiff-thousands-of-americans-are-dead-because-we-didnt-successfully-impeach-and-remove-trump-n2567615,NDPACKER,No Adam.  Thousands of Americans are dead because YOU chose to pursue a made up impeachment of our president.  If anyone should be dead it should be you.  Gofundme page anyone?,,,Deplorable Pelosi Schmelosi,93,?
1173,Twitchy,‘This is all a joke’: Chris Cuomo gets served a heaping dose of self-awareness after sl…,['2020/04/25'],115 comments,https://twitchy.com/dougp-3137/2020/04/25/this-is-all-a-joke-chris-cuomo-gets-served-a-heaping-dose-of-self-awareness-after-slamming-trump-about-coronavirus-and-disinfectants/,NDPACKER,Get in the boat Fredo.,,,keyboard jockey,5,?
1174,The Daily Wire,Pennsylvania Forced To Remove Hundreds Of Deaths From Coronavirus Death Coun…,[],446 comments,https://www.dailywire.com/news/pennsylvania-forced-to-remove-hundreds-of-deaths-from-coronavirus-death-count-after-coroners-raise-red-flags,NDPACKER,And their heads.,,,Ray D.,1,?
1175,The Daily Wire,Pennsylvania Forced To Remove Hundreds Of Deaths From Coronavirus Death Coun…,[],446 comments,https://www.dailywire.com/news/pennsylvania-forced-to-remove-hundreds-of-deaths-from-coronavirus-death-count-after-coroners-raise-red-flags,NDPACKER,"It is way, way too late for that.  Killing them is the only solution at this point.",,,Guest,1,2
1176,The Daily Wire,Pennsylvania Forced To Remove Hundreds Of Deaths From Coronavirus Death Coun…,[],446 comments,https://www.dailywire.com/news/pennsylvania-forced-to-remove-hundreds-of-deaths-from-coronavirus-death-count-after-coroners-raise-red-flags,NDPACKER,We need to start killing liberals to save our country.,,,Anna,3,2
1177,Twitchy,‘Somebody called the manager’: Rep. Thomas Massie mocks WH reporter who…,['2020/04/25'],99 comments,https://twitchy.com/dougp-3137/2020/04/25/somebody-called-the-manager-rep-thomas-massie-mocks-wh-reporter-who-took-offense-to-a-gif-he-liked/,NDPACKER,"Hunter Walker is just one more sniveling, lying, liberal communist propagandist to be ignored.",,,,2,?
1178,Twitchy,Former head of Planned Parenthood joins #CNNSesameStreet coronavirus special t…,['2020/04/25'],123 comments,https://twitchy.com/dougp-3137/2020/04/25/former-head-of-planned-parenthood-joins-cnnsesamestreet-coronavirus-special-to-tell-kids-how-to-protect-themselves-from-harm/,NDPACKER,Killing children is more than a hobby to democrats.,,,,13,?
1179,The Daily Wire,California Tried To Force Background Checks For Ammo. A Judge Sided With T…,[],233 comments,https://www.dailywire.com/news/california-tried-to-force-background-checks-for-ammo-a-judge-sided-with-the-second-amendment,NDPACKER,So the Peoples Republic of California is for idiots?  Makes sense now.  Thanks!,,,L84Cabo,0,0
1180,The Daily Wire,California Tried To Force Background Checks For Ammo. A Judge Sided With T…,[],233 comments,https://www.dailywire.com/news/california-tried-to-force-background-checks-for-ammo-a-judge-sided-with-the-second-amendment,NDPACKER,"That does not answer my question.  You forgot to answer the ""self-respecting"" part of it.",,,Keiichi,0,0
1181,The Daily Wire,California Tried To Force Background Checks For Ammo. A Judge Sided With T…,[],233 comments,https://www.dailywire.com/news/california-tried-to-force-background-checks-for-ammo-a-judge-sided-with-the-second-amendment,NDPACKER,Why would any self-respecting American want to live in the oppressive anti-American Peoples Republic of California?,,,EARNED,2,?
1182,Twitchy,Delete your account: Richard Marx proves he’s the REAL creepsh*t in tweet-pic advi…,['2020/04/24'],84 comments,https://twitchy.com/samj-3930/2020/04/24/delete-your-account-richard-marx-proves-hes-the-real-creepsht-in-tweet-pic-advising-others-how-to-troll-trump-supporters/,NDPACKER,I would have thought he would have died from AIDS by now.,,,rcn,0,0
1183,Townhall,Trump Puts WaPo Reporter In His Place: 'I’m the President and You’re Fake News',['2020/04/24'],384 comments,https://townhall.com/tipsheet/leahbarkoukis/2020/04/24/trump-wapo-reporter-fake-news-n2567556,NDPACKER,"Philip Rucker is just another America hating, sniveling, lying liberal communist propagandist to be ignored.  Boycott ALL of the America hating media and make America Great Again!I don't know if anyone caught this, but at the end of the update last night President Trump said something to the effect that we would have a much better country if the press were honest.No truer words have ever been spoken.",,,Richard Murray,12,?
1184,The Daily Wire,Ocasio-Cortez Only Democrat To Vote Against Funding To Help Americans,[],539 comments,https://www.dailywire.com/news/ocasio-cortez-only-democrat-to-vote-against-funding-to-help-americans,NDPACKER,Agreed.  She just needs to go away.,,,B68W,3,?
1185,Twitchy,‘You clown’: Pharmaceutical ‘expert’ Jake Tapper’s dig at Trump over HCQ does NO…,['2020/04/23'],148 comments,https://twitchy.com/samj-3930/2020/04/23/you-clown-pharmaceutical-expert-jake-tappers-dig-at-trump-over-hcq-does-not-end-well-for-him-like-at-all/,NDPACKER,"Jake Tapper is just one more sniveling, lying, liberal communist propagandist to be ignored.",,,,21,?
1186,The Daily Wire,Iranian General Orders ‘Naval Forces To Destroy Any American’ Ship In Persian G…,[],366 comments,https://www.dailywire.com/news/iranian-general-orders-naval-forces-to-destroy-any-american-ship-in-persian-gulf-that-threatens-security,NDPACKER,Gen. Hossein Salami look up.  Is it a bird?  Is it a plane?  It's an AGM-114 Hellfire missile!,,,Ronin,4,?
1187,Townhall,Trump Instructs Navy to 'Destroy' Hostile Iranian Gunboats,['2020/04/22'],634 comments,https://townhall.com/tipsheet/leahbarkoukis/2020/04/22/trump-iran-gunboats-n2567387,NDPACKER,I hope you are one of the first to die in that war you are talking about.,,,MKE,2,?
1188,Townhall,Trump Instructs Navy to 'Destroy' Hostile Iranian Gunboats,['2020/04/22'],634 comments,https://townhall.com/tipsheet/leahbarkoukis/2020/04/22/trump-iran-gunboats-n2567387,NDPACKER,You are nothing but another sniveling lying liberal cowardly communist propagandist that needs to be reported and blocked.,,,MKE,1,2
1189,Townhall,Trump Instructs Navy to 'Destroy' Hostile Iranian Gunboats,['2020/04/22'],634 comments,https://townhall.com/tipsheet/leahbarkoukis/2020/04/22/trump-iran-gunboats-n2567387,NDPACKER,They make it up and spread lies.  All democrats lie all the time.,,,mason89,12,?
1190,Townhall,Trump Instructs Navy to 'Destroy' Hostile Iranian Gunboats,['2020/04/22'],634 comments,https://townhall.com/tipsheet/leahbarkoukis/2020/04/22/trump-iran-gunboats-n2567387,NDPACKER,"What a sniveling, lying, liberal communist propagandist troll you are.  Reported and blocked!",,,Guest,20,?
1191,Townhall,Trump Instructs Navy to 'Destroy' Hostile Iranian Gunboats,['2020/04/22'],634 comments,https://townhall.com/tipsheet/leahbarkoukis/2020/04/22/trump-iran-gunboats-n2567387,NDPACKER,Thank GOD for President Trump.,,,rob,30,?
1192,Twitchy,‘Unreal’! ‘Gaslighter of the House’ Nancy Pelosi assigns blame for delay of latest c…,['2020/04/22'],123 comments,https://twitchy.com/dougp-3137/2020/04/22/unreal-gaslighter-of-the-house-nancy-pelosi-assigns-blame-for-delay-of-latest-coronavirus-relief-bill-just-guess/,NDPACKER,The sooner the American people realize that all democrats lie all the time the sooner we can vote them all out of office and MAGA!,,,Melissa Thomas,1,?
1193,Twitchy,WATCH: Idaho mom ARRESTED in front of her kids during ‘playdate protest’,['2020/04/22'],292 comments,https://twitchy.com/gregp-3534/2020/04/22/watch-idaho-mom-arrested-in-front-of-her-kids-during-playdate-protest/,NDPACKER,"I guess the cops in Meridian, Idaho will have to die along with the Nazis that run the town.",,,idontknow,0,0
1194,Twitchy,Canceled: MSNBC’s Lawrence O’Donnell says Dr. Deborah Birx ‘is now functionin…,['2020/04/21'],110 comments,https://twitchy.com/brettt-3136/2020/04/21/canceled-msnbcs-lawrence-odonnell-says-dr-deborah-birx-is-now-functioning-as-a-republican-lawyer/,NDPACKER,"Lawrence O’Donnell is just one more sniveling, lying , liberal communist propagandist to be ignored.",,,Guest,3,?
1195,Twitchy,Brian Stelter really needs to do a better job reporting on Chris Cuomo and his wife’s…,['2020/04/21'],75 comments,https://twitchy.com/gregp-3534/2020/04/21/brian-stelter-really-needs-to-do-a-better-job-reporting-on-chris-cuomo-and-his-wifes-coronavirus-recovery/,NDPACKER,Fredo and his homely wife get no sympathy from me.,,,,1,?
1196,The Daily Wire,Less Than Half Of Adults In Los Angeles Now Have Jobs,[],72 comments,https://www.dailywire.com/news/less-than-half-of-adults-in-los-angeles-now-have-jobs,NDPACKER,"This could not happen to a nicer city.  Well maybe New York, Chicago, Seattle, Minneapolis, Denver, etc, etc.  All controlled by democrats.  See the pattern?",,,Le Chat Noir,1,?
1197,The Daily Wire,"‘GO F*** YOURSELF, GRETCH’: Michigan Governor Grilled Over WWII Comments",[],342 comments,https://www.dailywire.com/news/go-f-yourself-gretch-michigan-governor-grilled-over-wwii-comments,NDPACKER,"And buy pot, but no garden seeds for you!",,,Sara Smith,6,?
1198,The Daily Wire,"‘GO F*** YOURSELF, GRETCH’: Michigan Governor Grilled Over WWII Comments",[],342 comments,https://www.dailywire.com/news/go-f-yourself-gretch-michigan-governor-grilled-over-wwii-comments,NDPACKER,She will start taking all the guns next.  She needs to do that so she can take everyone's money and property.,,,Rick,0,0
1199,Twitchy,‘Media is gonna flip’: Trump tweets that he’ll ‘sign an Executive Order to tempora…,['2020/04/20'],335 comments,https://twitchy.com/dougp-3137/2020/04/20/media-is-gonna-flip-trump-tweets-that-hell-sign-an-executive-order-to-temporarily-suspend-immigration-into-the-us-and-whoa-nelly/,NDPACKER,Thank God for President Trump!MAGA!,,,HiltonHead_Dude,6,?
1200,Twitchy,"COVID-19 infected George Stephanopoulos, wearing his mask as a…",['2020/04/21'],67 comments,https://twitchy.com/gregp-3534/2020/04/21/covid-19-infected-george-stephanopoulos-wearing-his-mask-as-a-necklace-seen-walking-in-the-hamptons/,NDPACKER,"I would be okay with him dying from the virus, or anything else for that matter.",,,El Mas Taco,5,?
1201,Townhall,It Looks Like CNN Blew the Kim Jong-un Is Dead or Dying Story…And They’re Not Al…,['2020/04/21'],432 comments,https://townhall.com/tipsheet/mattvespa/2020/04/21/it-looks-like-cnn-blew-the-kim-jongun-is-dead-or-dying-storyand-theyre-not-alone-n2567292,NDPACKER,Katy Turd lives up to her name again.,,,Skizzix,33,?
1202,Townhall,Fireworks: Trump Dunks on Argumentative Reporters at White House Press Briefing,['2020/04/19'],529 comments,https://townhall.com/tipsheet/bronsonstocking/2020/04/19/fireworks-trump-dunks-on-argumentative-reporters-at-white-house-briefing-n2567206,NDPACKER,"Weijia Jiang is just another communist propagandist that should be tried for treason, found guilty and hanged by her neck until dead.",,,JohnMcIntyre,3,1
1203,Twitchy,‘This is helping’: The New York Times tries to blame a Brooklyn man’s coronavirus…,['2020/04/19'],131 comments,https://twitchy.com/jacobb-38/2020/04/19/this-is-helping-the-new-york-times-tries-to-blame-a-brooklyn-mans-coronavirus-death-on-fox-news/,NDPACKER,The New York Times:  All the lies fit to print.,,,Michael Goldman,3,?
1204,Twitchy,‘Hello 9-1-1? I’d like to report a murder’. Dan Crenshaw leaves Bill Maher SPEECH…,['2020/04/19'],246 comments,https://twitchy.com/samj-3930/2020/04/19/hello-9-1-1-id-like-to-report-a-murder-dan-crenshaw-leaves-bill-maher-speechless-in-interview-about-trump-covid-watch/,NDPACKER,God bless Dan Crenshaw!,,,emtae,21,?
1205,Twitchy,New Jersey woman charged with organizing a protest against state’s stay-…,['2020/04/18'],350 comments,https://twitchy.com/brettt-3136/2020/04/18/new-jersey-woman-charged-with-organizing-a-protest-against-states-stay-at-home-orders/,NDPACKER,Is it time to start killing tyrants?,,,nodhimmi,2,?
1206,Twitchy,Bestselling author says be prepared for riots and violence in the streets when Pr…,['2020/04/18'],244 comments,https://twitchy.com/brettt-3136/2020/04/18/bestselling-author-says-be-prepared-for-riots-and-violence-in-the-streets-when-president-trump-loses-in-2020/,NDPACKER,Don Winslow should be the first to die when the shooting begins.,,,mrdaveno1,0,0
1207,Twitchy,"Hey guys, Tater has a sad — After months of cheerleading the worst aspects of the…",['2020/04/18'],262 comments,https://twitchy.com/brads-313037/2020/04/18/hey-guys-tater-has-a-sad-after-months-of-cheerleading-the-worst-aspects-of-the-pandemic-brian-stelter-has-a-breakdown/,NDPACKER,Dear Diary:,,,UhOhChongo,7,?
1208,Townhall,SD Gov. Kristi Noem Claps Back at Critics Who Wanted Her to Implement a Statewi…,['2020/04/18'],1382 comments,https://townhall.com/tipsheet/bethbaumann/2020/04/18/sd-gov-kristi-noem-claps-back-at-critics-who-wanted-her-to-implement-a-statewide-stayathome-order-n2567167,NDPACKER,All main stream media hat America and all Americans.  Ignore them.,,,American overseas,2,?
1209,Townhall,Adam Schiff Begs Trump to Stop Blaming China and the WHO for the Wuhan Coron…,['2020/04/17'],1337 comments,https://townhall.com/tipsheet/juliorosas/2020/04/17/adam-schiff-begs-trump-to-stop-blaming-china-and-the-who-for-the-wuhan-coronavirus-pandemic-n2567159,NDPACKER,"Adam Schiff should have died a long, long time ago.",,,,1,?
1210,Townhall,Brutal: Pelosi's Terrible Answer About Why Democrats Keep Blocking Needed Rescu…,['2020/04/17'],746 comments,https://townhall.com/tipsheet/guybenson/2020/04/17/listen-pelosis-terrible-answer-about-why-democrats-keep-blocking-needed-rescue-funds-for-small-businesses-n2567120,NDPACKER,We must completely remove the vile hatred that is known as the democrat party from our country.,,,Worcester Rooster,23,?
1211,Twitchy,"Psst, it’s totally POLITICAL: Kimberley Strassel knows why Democrats REALLY k…",['2020/04/17'],115 comments,https://twitchy.com/samj-3930/2020/04/17/psst-its-totally-political-kimberley-strassel-knows-why-democrats-really-keep-moving-the-covid-shutdown-goalposts/amp/?__twitter_impression=true,NDPACKER,This is why we must kill ALL of the democrats before they kill all of us.,,,,1,?
