,Site Name,Article Name,Article Date,Total Article Comments,Article URL,Username,Comments,Hate?,Flag ???,Responding to,Upvotes,Downvotes
360,Townhall,Epstein Docs Were Unsealed. The FBI Knew About Creepy Allegations…And Did Noth…,['2020/07/31'],611 comments,https://townhall.com/tipsheet/mattvespa/2020/07/31/maxwellepstein-docs-n2573489,NDPACKER,When did the monkey muslim know about all of this?,,,Gary Lancaster,3,1
361,Twitchy,"Seattle police find van ‘filled with tasers, bear spray, spike strips and an IED’ that…",['2020/07/30'],90 comments,https://twitchy.com/gregp-3534/2020/07/30/seattle-police-find-van-filled-with-tasers-bear-spray-spike-strips-and-an-ied-that-were-allegedly-handed-out-to-rioters-on-sunday/,NDPACKER,Kill them all before they kill all of us.,,,,11,?
362,Twitchy,‘A devastating reality’: Poll on which industries have gained or lost public trus…,['2020/07/30'],79 comments,https://twitchy.com/dougp-3137/2020/07/30/a-devastating-reality-poll-on-which-industries-have-gained-or-lost-public-trust-during-coronavirus-pandemic-hits-the-media-right-between-the-eyes/amp/,NDPACKER,Those are the people that choose to be lied to all the time.,,,Mc bc,5,?
363,Twitchy,‘A devastating reality’: Poll on which industries have gained or lost public trus…,['2020/07/30'],79 comments,https://twitchy.com/dougp-3137/2020/07/30/a-devastating-reality-poll-on-which-industries-have-gained-or-lost-public-trust-during-coronavirus-pandemic-hits-the-media-right-between-the-eyes/amp/,NDPACKER,"Or not, if you choose correctly.",,,Sean Patrick Murphy sr,1,?
364,Twitchy,‘A devastating reality’: Poll on which industries have gained or lost public trus…,['2020/07/30'],79 comments,https://twitchy.com/dougp-3137/2020/07/30/a-devastating-reality-poll-on-which-industries-have-gained-or-lost-public-trust-during-coronavirus-pandemic-hits-the-media-right-between-the-eyes/amp/,NDPACKER,Why pay someone to lie to you all the time about everything?,,,,11,?
365,Twitchy,‘A devastating reality’: Poll on which industries have gained or lost public trus…,['2020/07/30'],79 comments,https://twitchy.com/dougp-3137/2020/07/30/a-devastating-reality-poll-on-which-industries-have-gained-or-lost-public-trust-during-coronavirus-pandemic-hits-the-media-right-between-the-eyes/amp/,NDPACKER,"Do yourself, your family, your neighbors and your country and cancel any newspaper, magazine, cable TV or dish subscription you have.  Stop watching all local and national over-the-air broadcasts and Make America Great Again!",,,,11,?
366,Townhall,Federal Agents Are Leaving Downtown Portland,['2020/07/29'],294 comments,https://townhall.com/tipsheet/cortneyobrien/2020/07/29/federal-agents-are-leaving-portland-n2573370,NDPACKER,Because Trump is caving into the liberal demands to stop protecting federal property.,,,Hessie L. Harris,0,0
367,Townhall,Federal Agents Are Leaving Downtown Portland,['2020/07/29'],294 comments,https://townhall.com/tipsheet/cortneyobrien/2020/07/29/federal-agents-are-leaving-portland-n2573370,NDPACKER,"I never thought I would say this, but I might as well vote for Biden now.",,,Anthony Aaron,2,?
368,Twitchy,"Suuure, go with THAT: NYT really STEPS in it with ludicrous headline trashing the s…",['2020/07/30'],123 comments,https://twitchy.com/samj-3930/2020/07/30/suuure-go-with-that-nyt-really-steps-in-it-with-ludicrous-headline-trashing-the-suburbs-after-trump-scraps-fair-housing/,NDPACKER,"Cancel every newspaper, magazine, cable TV or dish subscription you have and Make America Great Again!",,,Roscoe,4,?
369,The Daily Wire,Trump Repeals Obama-Biden Rule: Suburbanites ‘Will No Longer Be’ ‘Hurt’…,[],360 comments,https://www.dailywire.com/news/trump-repeals-obama-biden-rule-suburbanites-will-no-longer-be-hurt-by-low-income-housing-built-in-neighborhoods,NDPACKER,HAHAHAHAHAHAHAHAHAHAHAHAHAHAHAHAHAHA!  MAKING AMERICA GREAT AGAIN ONE NEIGHBORHOOD AT A TIME!,,,,1,?
370,Townhall,Why a County Sheriff Told a Local Library Not to Dial 911,['2020/07/29'],505 comments,https://townhall.com/tipsheet/bethbaumann/2020/07/29/why-a-county-sheriff-told-a-local-library-not-to-dial-911-n2573399,NDPACKER,They can call black lies matter the next time they need help.,,,TimothyLane,2,?
371,The Daily Wire,"OVER? White House, Oregon Governor In Discussions To Draw Down Fed Presence…",[],124 comments,https://www.dailywire.com/news/over-white-house-oregon-governor-in-discussions-to-draw-down-fed-presence-in-portland-per-report,NDPACKER,It will be time to change my vote from Trump to Biden if this really happens.,,,denroy3,0,0
372,Twitchy,‘A thousand times this’! Greg Gutfeld spotted something worse than the ‘unbe…,['2020/07/29'],164 comments,https://twitchy.com/dougp-3137/2020/07/29/a-thousand-times-this-greg-gutfeld-spotted-something-worse-than-the-unbending-mob-on-the-street-and-it-came-courtesy-of-unhinged-dems-at-the-barr-hearing/,NDPACKER,"The ""unbending mob on the street"" is led and funded by democrats. This is why we must kill all of them before they kill all of us.",,,NeoKong,3,?
373,Townhall,Watch: Barr Laughs at PA Lawmaker Who Doesn't Even Know What Policy She's As…,['2020/07/29'],1236 comments,https://townhall.com/tipsheet/cortneyobrien/2020/07/29/watch-barr-laughs-at-pa-lawmaker-who-doesnt-even-know-what-policy-shes-asking-him-about-n2573313,NDPACKER,"Q:  Who would ever vote for her?  A: Immature children, i.e. democrats.",,,,0,0
374,Townhall,Watch: Barr Laughs at PA Lawmaker Who Doesn't Even Know What Policy She's As…,['2020/07/29'],1236 comments,https://townhall.com/tipsheet/cortneyobrien/2020/07/29/watch-barr-laughs-at-pa-lawmaker-who-doesnt-even-know-what-policy-shes-asking-him-about-n2573313,NDPACKER,democrat women are the ugliest most hate-filled women on Earth.,,,RetCivServ,16,?
375,Townhall,It's Kamala Harris? It Really Does Look Like the Biden Camp Might Have Botched The…,['2020/07/29'],944 comments,https://townhall.com/tipsheet/mattvespa/2020/07/29/its-harris-it-really-does-look-like-the-biden-camp-might-have-botched-their-vp-rollout-n2573341,NDPACKER,"""The Daily Wire is one of America’s fastest-growing conservative media companies and counter-cultural outlets for news""No greater lie has been told to the American people.",,,,0,0
376,The Daily Wire,Barr Shreds Democrats During Hostile Questioning: Democrats Won’t Condemn…,[],411 comments,https://www.dailywire.com/news/barr-shreds-democrats-during-hostile-questioning-democrats-wont-condemn-mob-violence-attacks-on-federal-courts,NDPACKER,"""The Daily Wire is one of America’s fastest-growing conservative media companies and counter-cultural outlets for news,""No greater lie has ever been told to the American people.",,,,8,?
377,The Daily Wire,WATCH: Democrat Tries To Pressure Barr To Commit To Not Releasing Results Fro…,[],147 comments,https://www.dailywire.com/news/watch-democrat-tries-to-pressure-barr-to-commit-to-not-releasing-results-from-durham-investigation-before-election,NDPACKER,Our world would be so much better if every democrat died and went to Hades.,,,Alan,5,?
378,Townhall,NYPD Issues Statement After MSNBC Host Falsely Claims Arrest Was Kidnapping,['2020/07/29'],67 comments,https://townhall.com/tipsheet/leahbarkoukis/2020/07/29/nypd-issues-statement-after-msnbc-host-falsely-claims-arrest-was-kidnapping-n2573348,NDPACKER,ALL democrats and ALL members of the main stream media LIE ALL THE TIME.,,,soliton,4,?
379,Twitchy,Chris Hayes accuses NYPD of kidnapping after arrest of a woman by plainclothes c…,['2020/07/29'],242 comments,https://twitchy.com/gregp-3534/2020/07/29/chris-hayes-accuses-nypd-of-kidnapping-after-arrest-of-a-woman-by-plainclothes-cops-using-an-unmarked-minivan-goes-viral/,NDPACKER,Stop the insanity and lying.  Kill every member of the main stream media.,,,leia,6,?
380,Townhall,DOJ Nabs Nearly Two Dozen Portland Anarchists for Attacks on Federal Courth…,['2020/07/28'],215 comments,https://townhall.com/tipsheet/katiepavlich/2020/07/28/doj-nabs-nearly-two-dozen-arrests-of-portland-anarchists-n2573253,NDPACKER,There is no stupidity in my brain.   Why do you allow Satan to put so much hate in your heart?,,,david reedy,1,?
381,Townhall,DOJ Nabs Nearly Two Dozen Portland Anarchists for Attacks on Federal Courth…,['2020/07/28'],215 comments,https://townhall.com/tipsheet/katiepavlich/2020/07/28/doj-nabs-nearly-two-dozen-arrests-of-portland-anarchists-n2573253,NDPACKER,Are you high?  Your post makes no sense.,,,neosteeled001 .,1,?
382,Townhall,DOJ Nabs Nearly Two Dozen Portland Anarchists for Attacks on Federal Courth…,['2020/07/28'],215 comments,https://townhall.com/tipsheet/katiepavlich/2020/07/28/doj-nabs-nearly-two-dozen-arrests-of-portland-anarchists-n2573253,NDPACKER,It is exactly related to your whiny liberal negative post.,,,TOM SIMS,1,?
383,Townhall,DOJ Nabs Nearly Two Dozen Portland Anarchists for Attacks on Federal Courth…,['2020/07/28'],215 comments,https://townhall.com/tipsheet/katiepavlich/2020/07/28/doj-nabs-nearly-two-dozen-arrests-of-portland-anarchists-n2573253,NDPACKER,I think the words you seek are domestic terrorists.,,,Trafalgar,14,?
384,Townhall,DOJ Nabs Nearly Two Dozen Portland Anarchists for Attacks on Federal Courth…,['2020/07/28'],215 comments,https://townhall.com/tipsheet/katiepavlich/2020/07/28/doj-nabs-nearly-two-dozen-arrests-of-portland-anarchists-n2573253,NDPACKER,Why do you have so much hate in your heart.  Was it God or Satan that put it there?,,,TOM SIMS,1,?
385,Townhall,"Jim Jordan Airs Disturbing, Yet Powerful Video During Bill Barr Hearing",['2020/07/28'],845 comments,https://townhall.com/tipsheet/cortneyobrien/2020/07/28/jim-jordan-video-n2573284,NDPACKER,Kill them all before they kill all of us.,,,mcd1948,3,?
386,Townhall,A Republican Governor Will Not Commit to Voting For Trump,['2020/07/28'],338 comments,https://townhall.com/tipsheet/leahbarkoukis/2020/07/28/larry-hogan-trump-n2573263,NDPACKER,"Larry Hogan is a sniveling, lying, liberal communist that should be ignored.MAGA!",,,Papa Blue Stars,11,1
387,Townhall,Seattle Mayor Claims Trump Sending Federal Agents to Cities Is a 'Dry Run' for…,['2020/07/28'],293 comments,https://townhall.com/tipsheet/juliorosas/2020/07/28/seattle-mayor-claims-trump-sending-federal-agents-to-cities-is-a-dry-run-for-martial-law-n2573261,NDPACKER,"When will the sniveling, lying liberal communist propagandist understand we no longer believe ANYTHING they say about ANYTHING?",,,AZ Knight,21,?
388,Twitchy,Sad face! Brian Stelter accused of breaching CNN’s confidentiality agreem…,['2020/07/27'],171 comments,https://twitchy.com/samj-3930/2020/07/27/sad-face-brian-stelter-accused-of-breaching-cnns-confidentiality-agreement-with-nick-sandmann-may-cost-him-his-job/,NDPACKER,"Brian Stelter:  Still bald.  Still fat.  Still stupid.  And hopefully soon to be an unemployed sniveling, lying, liberal communist propagandist.",,,Demitrix Waller,0,0
389,Twitchy,"After spending weekend in Portland fed courthouse with U.S. Marshals, AP repor…",['2020/07/27'],150 comments,https://twitchy.com/samj-3930/2020/07/27/after-spending-weekend-in-portland-fed-courthouse-with-u-s-marshals-ap-reporters-damning-thread-puts-an-end-to-the-its-peaceful-bs/,NDPACKER,"Lloyd was convicted of pistol whipping a woman almost to death.  He spent 7 years in prison, but he was a""good boy""  according to his family.",,,vladdy1,1,?
390,Twitchy,"After spending weekend in Portland fed courthouse with U.S. Marshals, AP repor…",['2020/07/27'],150 comments,https://twitchy.com/samj-3930/2020/07/27/after-spending-weekend-in-portland-fed-courthouse-with-u-s-marshals-ap-reporters-damning-thread-puts-an-end-to-the-its-peaceful-bs/,NDPACKER,"Thank God for Mike Balsamo getting the truth out to the American people unlike the rest of the sniveling, lying, liberal main stream communist propagandists.",,,,14,?
391,Twitchy,‘This fool thinks he’s in charge’: Portland Mayor Ted Wheeler demands immediate…,['2020/07/27'],313 comments,https://twitchy.com/dougp-3137/2020/07/27/this-fool-thinks-hes-in-charge-portland-mayor-ted-wheeler-demands-immediate-meeting-with-dhs-officials-to-negotiate-a-cease-fire/,NDPACKER,He is now antifa's chief spokesperson and negotiator.,,,syvyn11,14,?
392,Twitchy,Sh*t just got really REAL! Elon Musk absolutely nukes the Left in 1 brutally ho…,['2020/07/27'],146 comments,https://twitchy.com/samj-3930/2020/07/27/sht-just-got-really-real-elon-musk-absolutely-nukes-the-left-in-1-brutally-honest-tweet-and-they-just-cant-deal/,NDPACKER,democrats = lemmings heading for the cliff.,,,SupplyGuy,4,?
393,Twitchy,‘Reality sinking in’? Joe Scarborough notices ‘peaceful protests’ in Portland n…,['2020/07/27'],124 comments,https://twitchy.com/dougp-3137/2020/07/27/reality-sinking-in-joe-scarborough-notices-peaceful-protests-in-portland-not-so-peaceful-after-all/,NDPACKER,After two months of violence the main stream liars are ready to tell us the truth?  Really?,,,nodhimmi,3,?
394,Twitchy,‘And…?’ Sports writer notes pro golfer was wearing Blue Lives Matter wristband at t…,['2020/07/27'],80 comments,https://twitchy.com/dougp-3137/2020/07/27/and-sports-writer-notes-pro-golfer-was-wearing-blue-lives-matter-wristband-at-tournament-just-20-minutes-away-from-where-george-floyd-was-killed/,NDPACKER,Only if we kill all of them before they kill us.,,,KC,2,?
395,Twitchy,‘And…?’ Sports writer notes pro golfer was wearing Blue Lives Matter wristband at t…,['2020/07/27'],80 comments,https://twitchy.com/dougp-3137/2020/07/27/and-sports-writer-notes-pro-golfer-was-wearing-blue-lives-matter-wristband-at-tournament-just-20-minutes-away-from-where-george-floyd-was-killed/,NDPACKER,Would an ISIS member please remove Joel Beall's racist head?  Thank you.,,,Ricardo Sosa,4,?
396,Twitchy,NEVER surrender: Thread decimating the Left for flat-out lying about fighting fasci…,['2020/07/27'],209 comments,https://twitchy.com/samj-3930/2020/07/27/never-surrender-thread-decimating-the-left-for-flat-out-lying-about-fighting-fascism-is-one-helluva-read-youll-fist-pump/,NDPACKER,"Yeah, sure.  Anyways the post was lucid, well thought out and truthful.  Protienwisdom's...not yours.",,,Joatmoaf,0,0
397,Townhall,Seattle Radio Host Who Supported CHAZ Has a Change of Heart After Rioters Attac…,['2020/07/27'],687 comments,https://townhall.com/tipsheet/juliorosas/2020/07/27/seattle-radio-host-who-supported-chaz-has-a-change-of-heart-after-rioters-attack-his-apartment-n2573173,NDPACKER,This could not be happening to a better bunch of anti-American liberals.  Burn that city to the ground!,,,JustSomeGuy,7,?
398,Twitchy,Tom Arnold attempts to discredit Andy Ngo and catches it right in the ratio; Don’t ‘b…,['2020/07/27'],109 comments,https://twitchy.com/brads-313037/2020/07/27/tom-arnold-attempts-to-discredit-andy-ngo-and-catches-it-right-in-the-ratio-dont-believe-him-without-checking-he-says-in-response-to-photographic-evidence/,NDPACKER,Who is this Tom Arnold of which you speak?,,,,16,?
399,Twitchy,Austin police give an update in the shooting of Black Lives Matter protester…,['2020/07/26'],358 comments,https://twitchy.com/gregp-3534/2020/07/26/austin-police-give-an-update-in-the-shooting-of-black-lives-matter-protester-garrett-foster/,NDPACKER,"Just some anti-American democrat idiot getting shot for pointing a gun at an American.  I hope it will be the first of thousands, but as you saw all of the immature children scatter screaming like little girls...probably not.",,,Kilroy,5,?
400,Townhall,Nadler Still Thinks Antifa Is a 'Myth',['2020/07/27'],487 comments,https://townhall.com/tipsheet/leahbarkoukis/2020/07/27/nadler-still-thinks-antifa-is-a-myth-n2573164,NDPACKER,Why is nadless jerry nadler still alive?,,,,0,0
401,Twitchy,‘Life comes at you fast’: Blue-check telling Trump to ‘chill dawg’ over Seattle riots l…,['2020/07/26'],115 comments,https://twitchy.com/samj-3930/2020/07/26/life-comes-at-you-fast-blue-check-telling-trump-to-chill-dawg-over-seattle-riots-learns-he-was-right-the-hard-way-screenshots/,NDPACKER,I am so glad this is happening to those anti-American idiots that live in Seattle.  This just proves once again that Seattle has become a third-world sh*thole.,,,EWizzyE ✓JDSon,11,?
402,Townhall,WATCH: Leftist Mob Gathers Outside the Home of Acting DHS Secretary Chad Wolf,['2020/07/26'],664 comments,https://townhall.com/tipsheet/bronsonstocking/2020/07/26/leftist-mob-gathers-outside-dhs-secretary-wolfs-home-n2573138,NDPACKER,Kill all of the rioters.,,,Rockyone,4,1
403,Twitchy,"Calm down, they were just PROTESTING: CNN screeches over outdoor religious co…",['2020/07/26'],89 comments,https://twitchy.com/samj-3930/2020/07/26/calm-down-they-were-just-protesting-cnn-screeches-over-outdoor-religious-concert-while-giving-a-pass-to-1000s-rioting-in-the-streets/,NDPACKER,Why is CNN still in business?,,,keyboard jockey,7,?
404,Townhall,Get Woke And Go Broke: A&E Ratings Suffer After Caving to Lefty Mob By Canc…,['2020/07/25'],326 comments,https://townhall.com/tipsheet/mattvespa/2020/07/25/get-woke-and-go-broke-ae-ratings-suffer-after-caving-to-lefty-mob-by-canceling-n2573104,NDPACKER,"Not TCM, but the others and more.  More than we need.",,,Lou,0,0
405,Townhall,Get Woke And Go Broke: A&E Ratings Suffer After Caving to Lefty Mob By Canc…,['2020/07/25'],326 comments,https://townhall.com/tipsheet/mattvespa/2020/07/25/get-woke-and-go-broke-ae-ratings-suffer-after-caving-to-lefty-mob-by-canceling-n2573104,NDPACKER,I had a local guy mount an antenna on the dish bracket and we get 26 stations.,,,Sagebrush,2,?
406,Townhall,Get Woke And Go Broke: A&E Ratings Suffer After Caving to Lefty Mob By Canc…,['2020/07/25'],326 comments,https://townhall.com/tipsheet/mattvespa/2020/07/25/get-woke-and-go-broke-ae-ratings-suffer-after-caving-to-lefty-mob-by-canceling-n2573104,NDPACKER,Not if you NEVER watch it.,,,HubertP,2,?
407,Townhall,Customs and Border Protection Official Shreds the 'Peaceful Protests' in Portlan…,['2020/07/26'],569 comments,https://townhall.com/tipsheet/bethbaumann/2020/07/26/customs-and-border-protection-official-shreds-the-peaceful-protests-in-portland-narrative-n2573134,NDPACKER,"All cities, towns, counties, reservations and states run by democrats have officially become third-world sh*tholes.",,,,14,?
408,Twitchy,Parents who brought 6 month old daughter to Portland riot area think tear…,['2020/07/25'],177 comments,https://twitchy.com/dougp-3137/2020/07/25/parents-who-brought-6-month-old-daughter-to-portland-riot-area-think-tear-gas-risk-worth-it-because-she-got-to-witness-history/,NDPACKER,You mean the Wuhan virus?,,,MiguelLC,0,0
409,Twitchy,Parents who brought 6 month old daughter to Portland riot area think tear…,['2020/07/25'],177 comments,https://twitchy.com/dougp-3137/2020/07/25/parents-who-brought-6-month-old-daughter-to-portland-riot-area-think-tear-gas-risk-worth-it-because-she-got-to-witness-history/,NDPACKER,I call it what it is...CHILD ABUSE!,,,cajun_2,2,?
410,Twitchy,Parents who brought 6 month old daughter to Portland riot area think tear…,['2020/07/25'],177 comments,https://twitchy.com/dougp-3137/2020/07/25/parents-who-brought-6-month-old-daughter-to-portland-riot-area-think-tear-gas-risk-worth-it-because-she-got-to-witness-history/,NDPACKER,Those two should never be allowed to have children.,,,,10,1
411,Townhall,WATCH: WNBA Players Walk Off Basketball Court When National Anthem Starts Play…,['2020/07/25'],671 comments,https://townhall.com/tipsheet/bronsonstocking/2020/07/25/watch-wnba-players-walk-away-when-national-anthem-starts-playing-n2573117,NDPACKER,Golf...PGA,,,nutNice,2,?
412,Townhall,WATCH: WNBA Players Walk Off Basketball Court When National Anthem Starts Play…,['2020/07/25'],671 comments,https://townhall.com/tipsheet/bronsonstocking/2020/07/25/watch-wnba-players-walk-away-when-national-anthem-starts-playing-n2573117,NDPACKER,BOYCOTT ALL SPORTS EXCEPT GOLF!BOYCOTT ALL INDIAN CASINOS!,,,Cirocko,6,?
413,Twitchy,Brian Stelter trips over CNN in rush to help WaPo writer point out ‘there’s an entire…,['2020/07/25'],57 comments,https://twitchy.com/dougp-3137/2020/07/25/brian-stelter-trips-over-cnn-in-rush-to-help-wapo-writer-point-out-theres-an-entire-cable-network-devoted-to-filling-your-evenings-with-terror/,NDPACKER,"Brian Stelter:  Still bald.  Still fat.  Still stupid.  Still a sniveling, lying, liberal communist propagandist.",,,BossBass7o7,2,?
414,Townhall,The New DNC Platform is an Anti-White Screed,['2020/07/25'],418 comments,https://townhall.com/tipsheet/bronsonstocking/2020/07/25/proposed-dnc-platform-is-an-antiwhite-screed-n2573107,NDPACKER,It appears the dnc is carrying on the work of the muslim monkey to keep the race war in America going.,,,Deplorable Pelosi Schmelosi,8,?
415,Twitchy,Major League Baseball’s Twitter account goes ALL-IN to defend players (and a ma…,['2020/07/21'],217 comments,https://twitchy.com/dougp-3137/2020/07/21/major-league-baseballs-twitter-account-goes-all-in-to-defend-players-and-a-manager-kneeling-during-national-anthem-before-preseason-game/amp/,NDPACKER,You misread the poll like any good little democrat does.  It was 322 million people willing to kill you themselves.  I knew you could never name two people that care about someone like you that has their heart filled with hate.,,,MonkSox,0,0
416,Townhall,Get Woke And Go Broke: A&E Ratings Suffer After Caving to Lefty Mob By Canc…,['2020/07/25'],326 comments,https://townhall.com/tipsheet/mattvespa/2020/07/25/get-woke-and-go-broke-ae-ratings-suffer-after-caving-to-lefty-mob-by-canceling-n2573104,NDPACKER,"Do yourself, your family and your country a GREAT favor and cancel any cable or dish network you are wasting your money on.  Think about it...you are actually paying someone to lie to you all the time.",,,EileenDover,13,?
417,Townhall,"Uncanceled: After Threatened Lawsuit, Charity Boss Who Criticized BLM is Reins…",['2020/07/24'],162 comments,https://townhall.com/tipsheet/guybenson/2020/07/24/uncancel-culture-after-threatened-lawsuit-charity-boss-who-criticized-blm-is-reinstated-n2573046,NDPACKER,They do not.  Not even to each other.,,,Yourmom,2,?
418,Townhall,"Uncanceled: After Threatened Lawsuit, Charity Boss Who Criticized BLM is Reins…",['2020/07/24'],162 comments,https://townhall.com/tipsheet/guybenson/2020/07/24/uncancel-culture-after-threatened-lawsuit-charity-boss-who-criticized-blm-is-reinstated-n2573046,NDPACKER,You.  Are.  Wrong.,,,Yourmom,0,0
419,Townhall,Justice Department Announces Charges Against Rioters at Portland Courthouse,['2020/07/24'],1156 comments,https://townhall.com/tipsheet/bronsonstocking/2020/07/24/justice-department-announces-charges-against-18-for-violence-at-portland-courthouse-n2573102,NDPACKER,"229/27 us all you need to know to report and block this sniveling, lying, liberal communist propagandist.",,,Yourmom,0,0
420,Townhall,Justice Department Announces Charges Against Rioters at Portland Courthouse,['2020/07/24'],1156 comments,https://townhall.com/tipsheet/bronsonstocking/2020/07/24/justice-department-announces-charges-against-18-for-violence-at-portland-courthouse-n2573102,NDPACKER,I have a better idea.  Kill.  Them.  All.,,,RetCivServ,0,0
421,Twitchy,"‘Deformed but safe’: Major flooding in China threatens the Three Gorges Dam,…",['2020/07/24'],343 comments,https://twitchy.com/gregp-3534/2020/07/24/deformed-but-safe-major-flooding-in-china-threatens-the-three-gorges-dam-millions-at-risk/,NDPACKER,This is great news!,,,idontknow,1,1
422,Townhall,Networks Cut Away When WH Press Secretary Plays Footage of 'Peaceful' Pr…,['2020/07/24'],454 comments,https://townhall.com/tipsheet/bronsonstocking/2020/07/24/networks-cut-away-when-wh-press-secretary-plays-footage-of-peaceful-protests-n2573095,NDPACKER,That was one big fat ugly white full-of-hate white woman that NO-ONE WILL EVER LOVE at the end of the video.,,,www.TwitterCensors.com,25,?
423,Townhall,'Law and Order Will Prevail': McEnany Defends Trump Administration's Crack D…,['2020/07/24'],103 comments,https://townhall.com/tipsheet/reaganmccarthy/2020/07/24/kayleigh-1pm-n2573083,NDPACKER,Thank God for White House Press Secretary Kayleigh McEnany!,,,CWCal,7,?
424,Townhall,Birthday Present: Nick Sandmann Settles with the Washington Post,['2020/07/24'],397 comments,https://townhall.com/tipsheet/cortneyobrien/2020/07/24/nick-sandmann-settles-with-the-washington-post-n2573080,NDPACKER,I wonder what the prairie monkey got.,,,Jin Mugen,1,?
425,Twitchy,‘We get it. You’ve never read the Bible’: American Magazine comparing George Fl…,['2020/07/24'],183 comments,https://twitchy.com/samj-3930/2020/07/24/we-get-it-youve-never-read-the-bible-american-magazine-comparing-george-floyd-to-jesus-does-not-go-well-like-at-all/,NDPACKER,Comparing a convicted felon to Jesus Christ is like comparing any democrat to an honest person.  Neither are true.,,,RepublicanDon,8,?
426,Twitchy,Andy Ngo adds some much-needed context to Portland mayor’s tweets about anoth…,['2020/07/23'],131 comments,https://twitchy.com/dougp-3137/2020/07/23/andy-ngo-adds-some-much-needed-context-to-portland-mayors-tweets-about-another-powerful-night-in-his-city/,NDPACKER,Mayor ted should lose his life.,,,MTHarpooner,1,?
427,Twitchy,‘This is TIRESOME and insulting’: Sister Toldjah SHUTS AOC’s attempt at playing…,['2020/07/23'],115 comments,https://twitchy.com/samj-3930/2020/07/23/this-is-tiresome-and-insulting-sister-toldjah-shuts-aocs-attempt-at-playing-the-victim-down-in-1-perfect-tweet/,NDPACKER,Yoho didn't lie about her...,,,,8,?
