,Site Name,Article Name,Article Date,Total Article Comments,Article URL,Username,Comments,Hate?,Flag ???,Responding to,Upvotes,Downvotes
716,Twitchy,‘Even if they’re mostly peaceful rallies?’ CNN’s Chris Cillizza declares there to be ‘…,['2020/06/15'],101 comments,https://twitchy.com/dougp-3137/2020/06/15/even-if-theyre-mostly-peaceful-rallies-cnns-chris-cillizza-declares-there-to-be-no-reason-for-trumps-return-to-the-campaign-trail-this-week-and-people-have-thoughts/,NDPACKER,"Chris Cillizza is nothing more than a sniveling, lying liberal communist propagandist that should be ignored.MAGA!",,,Sheepdog413,4,?
717,Townhall,Trump Campaign Releases Guidelines for This Weekend's Rally,['2020/06/15'],358 comments,https://townhall.com/tipsheet/cortneyobrien/2020/06/15/trump-campaign-releases-guidelines-for-this-weekends-rally-n2570652,NDPACKER,The fake polls?,,,Lillian DeVore,1,?
718,Townhall,Trump Campaign Releases Guidelines for This Weekend's Rally,['2020/06/15'],358 comments,https://townhall.com/tipsheet/cortneyobrien/2020/06/15/trump-campaign-releases-guidelines-for-this-weekends-rally-n2570652,NDPACKER,Thank God for President Trump!MAGA!,,,Lillian DeVore,4,?
719,Twitchy,"‘Anger will never, EVER go away’: Bethany Mandel’s heart-wrenching thread about…",['2020/06/15'],115 comments,https://twitchy.com/samj-3930/2020/06/15/anger-will-never-ever-go-away-bethany-mandels-heart-wrenching-thread-about-how-lockdowns-hurt-families-a-powerful-must-read/,NDPACKER,I thought it would be brave men that would start shooting the f*ckers that are destroying this country.  It looks like it will be the brave women that we will need to do that.Thank God for these brave women.,,,,15,?
720,The Daily Wire,"ESPN Hits Ratings Low, Sports Journalist Blames ‘Wokecenter On Steroids’ Not Co…",[],146 comments,https://www.dailywire.com/news/espn-hits-ratings-low-sports-journalist-blames-wokecenter-on-steroids-not-coronavirus,NDPACKER,Cancel any paid cable or satellite package you have and MAGA!,,,,8,?
721,The Daily Wire,NBA’s Popovich: ‘The Flag Is Irrelevant. It’s Just A Symbol That People Glom Onto Fo…,[],216 comments,https://www.dailywire.com/news/nbas-popovich-the-flag-is-irrelevant-its-just-a-symbol-that-people-glom-onto-for-political-reasons,NDPACKER,This anti-American is the only reason anyone needs to never watch an NBA game again.,,,Yes....no,1,?
722,Townhall,Crenshaw Reminds CHAZ Anarchists Why They Can't Demand This List of Supplies,['2020/06/15'],943 comments,https://townhall.com/tipsheet/leahbarkoukis/2020/06/15/crenshaw-seattles-autonomous-zone-n2570635,NDPACKER,Put up a wall around it and do not let anyone leave.,,,T-White,4,?
723,The Daily Wire,"‘Unusually Large’ Number Of Minneapolis Police Are Quitting, Cite Lack Of Support…",[],92 comments,https://www.dailywire.com/news/unusually-large-number-of-minneapolis-police-are-quitting-cite-lack-of-support-from-citys-democrat-leaders-riots,NDPACKER,It looks like the third-world sh*thole known as Minneapolis will not have to de-fund its police department.  Good luck trying to find any qualified replacements for those that have left and are about to leave.,,,ApresNousLaFaillite,9,?
724,Twitchy,"‘You’re not a journalist, Brian’: Trump legal adviser Jenna Ellis calls Brian Stelt…",['2020/06/14'],146 comments,https://twitchy.com/jacobb-38/2020/06/14/youre-not-a-journalist-brian-trump-legal-adviser-jenna-ellis-calls-brian-stelter-an-activist-and-he-does-not-take-it-well/,NDPACKER,"Brian Stelter:  Still fat.  Still bald:  Still stupid.  Still a sniveling, lying. liberal fake-news communist propagandist.Thank God for Jenna Ellis!MAGA!",,,PittsburghTiger,3,?
725,Townhall,WATCH: Omar's Head-Scratching Explanation of What Dismantling the Mi…,['2020/06/14'],624 comments,https://townhall.com/tipsheet/bethbaumann/2020/06/14/watch-omars-head-scratching-explanation-of-what-dismantling-the-minneapolis-pol-n2570611,NDPACKER,All democrats do that all the time.  It's called lying.,,,Don,4,?
726,The Daily Wire,"Man Receives $1.1 million Hospital COVID-19 Bill With 3,000 Itemized Charges",[],185 comments,https://www.dailywire.com/news/man-receives-1-1-million-hospital-covid-19-bill-with-3000-itemized-charges,NDPACKER,Are you forgetting Oblowmecare?,,,Satanic Donut,2,?
727,The Daily Wire,"Man Receives $1.1 million Hospital COVID-19 Bill With 3,000 Itemized Charges",[],185 comments,https://www.dailywire.com/news/man-receives-1-1-million-hospital-covid-19-bill-with-3000-itemized-charges,NDPACKER,If the democrats can't kill you they will bankrupt you.,,,Teri Eggert,22,?
728,Twitchy,‘The IRONY’: S.E. Cupp’s nasty dig at Trump’s health on #TrumpIsNotWell goe…,['2020/06/14'],71 comments,https://twitchy.com/samj-3930/2020/06/14/the-irony-s-e-cupps-nasty-dig-at-trumps-health-on-trumpisnotwell-goes-oh-so-very-wrong-especially-for-joe-biden/,NDPACKER,"S.E. Cu*t is just one more sniveling, lying, liberal communist propagandist to be ignored.MAGA!",,,,6,?
729,Twitchy,‘People NEED to learn what’s going on!’ FOIA request shows CDC blackballed Gre…,['2020/06/14'],50 comments,https://twitchy.com/samj-3930/2020/06/14/people-need-to-learn-whats-going-on-foia-request-shows-cdc-blackballed-greta-van-susteren-during-covid-screenshot/,NDPACKER,The CDC is just another deep state anti-American democrat run organization.,,,,25,?
730,Twitchy,‘Is anyone in charge?’ CHAZ overnight update: Street sign argument breaks out…,['2020/06/13'],220 comments,https://twitchy.com/dougp-3137/2020/06/13/is-anyone-in-charge-chaz-overnight-update-street-sign-argument-breaks-out-dodgeball-game-marred-by-scuffle/,NDPACKER,"Lies, lies and more liberal lies.  Suicide anyone?",,,Elytherial Luna,0,0
731,Twitchy,‘Is anyone in charge?’ CHAZ overnight update: Street sign argument breaks out…,['2020/06/13'],220 comments,https://twitchy.com/dougp-3137/2020/06/13/is-anyone-in-charge-chaz-overnight-update-street-sign-argument-breaks-out-dodgeball-game-marred-by-scuffle/,NDPACKER,"I am not the one that made the claim.  You are.  Show me the proof, or admit you are nothing but a sniveling, lying, liberal communist propagandist.  Thank you.",,,HockeyShark,0,0
732,Twitchy,‘Is anyone in charge?’ CHAZ overnight update: Street sign argument breaks out…,['2020/06/13'],220 comments,https://twitchy.com/dougp-3137/2020/06/13/is-anyone-in-charge-chaz-overnight-update-street-sign-argument-breaks-out-dodgeball-game-marred-by-scuffle/,NDPACKER,"Nice try, but you are nothing but a sniveling, lying liberal communist propagandist if you cannot provide proof of your comment.",,,HockeyShark,0,0
733,Twitchy,‘Is anyone in charge?’ CHAZ overnight update: Street sign argument breaks out…,['2020/06/13'],220 comments,https://twitchy.com/dougp-3137/2020/06/13/is-anyone-in-charge-chaz-overnight-update-street-sign-argument-breaks-out-dodgeball-game-marred-by-scuffle/,NDPACKER,Please show me the PROOF.  Thank you.,,,Dan13,0,0
734,Twitchy,‘Is anyone in charge?’ CHAZ overnight update: Street sign argument breaks out…,['2020/06/13'],220 comments,https://twitchy.com/dougp-3137/2020/06/13/is-anyone-in-charge-chaz-overnight-update-street-sign-argument-breaks-out-dodgeball-game-marred-by-scuffle/,NDPACKER,"Do you have any proof of this, or is this just more communist propaganda?",,,chicagofred,1,?
735,Twitchy,‘Is anyone in charge?’ CHAZ overnight update: Street sign argument breaks out…,['2020/06/13'],220 comments,https://twitchy.com/dougp-3137/2020/06/13/is-anyone-in-charge-chaz-overnight-update-street-sign-argument-breaks-out-dodgeball-game-marred-by-scuffle/,NDPACKER,You give them your money through the tax system.  You should probably learn how to spend your money more wisely.,,,Whatru,0,0
736,Twitchy,‘Is anyone in charge?’ CHAZ overnight update: Street sign argument breaks out…,['2020/06/13'],220 comments,https://twitchy.com/dougp-3137/2020/06/13/is-anyone-in-charge-chaz-overnight-update-street-sign-argument-breaks-out-dodgeball-game-marred-by-scuffle/,NDPACKER,Perhaps they will all get the Wuhan virus and die.  That's what I hope happens.,,,Marty,1,1
737,Townhall,Civil Rights Attorney Leo Terrell Explains Why He 'Stopped Drinking the Democrat…,['2020/06/14'],646 comments,https://townhall.com/tipsheet/bethbaumann/2020/06/14/civil-rights-attorney-leo-terrell-explains-why-he-stopped-drinking-the-democratic-koolaid-n2570610,NDPACKER,ALL democrats and ALL members of the main stream media lie ALL the time.,,,Albert Alioto,15,?
738,Townhall,Molotov-Cocktail Throwing Lawyers Indicted on 7 Charges,['2020/06/13'],185 comments,https://townhall.com/tipsheet/bronsonstocking/2020/06/13/molotov-cocktail-throwing-lawyers-indicted-on-7-charges-n2570595,NDPACKER,HAHAHAHAHAHAHAHAHAHAHAHAHAHAHAHA!  Lock them up!,,,willi_beaux,6,?
739,The Daily Wire,Dr. Fauci Now Says Second Coronavirus Wave ‘Not Inevitable’,[],197 comments,https://www.dailywire.com/news/dr-fauci-now-says-second-coronavirus-wave-not-inevitable,NDPACKER,Fauci is just one more liberal hack to be ignored.MAGA!,,,MaggieGal (marpel)  I ❤️ Texas,3,?
740,Twitchy,‘PR for MMFA’: Brian Stelter & CNN do their part to help the Left promote Tucker Carl…,['2020/06/13'],82 comments,https://twitchy.com/dougp-3137/2020/06/13/pr-for-mmfa-brian-stelter-cnn-do-their-part-to-help-the-left-promote-tucker-carlson-ad-boycott/,NDPACKER,"Brian Stelter:  Still bald.  Still fat.  Still stupid.  Still a sniveling, lying, liberal communist propagandist.",,,immunestrength,6,?
741,Townhall,And This is Why the COVID Experts’ Credibility Is In Smoldering Ruins,['2020/06/13'],771 comments,https://townhall.com/tipsheet/mattvespa/2020/06/13/and-this-is-why-the-covid-experts-credibility-is-in-smoldering-ruins-n2570597,NDPACKER,Where was this monkey when all of the other monkeys were out looting and burning down America in groups numbered in the thousands?,,,Gail Watkins,9,?
742,Townhall,Rolling Stone Editor: The American Left Has Lost Its Mind and They're Destroying…,['2020/06/13'],1247 comments,https://townhall.com/tipsheet/mattvespa/2020/06/13/rolling-stone-editor-the-american-left-has-lost-its-mind-n2570592,NDPACKER,"""American left has gone totally insane and the liberal media is destroying itself. ""I can protect myself from the insane, but how do we completely destroy the media?",,,Ragnar,1,?
743,Townhall,It's Official: Minneapolis City Council Votes Unanimously to Abolish Police,['2020/06/12'],429 comments,https://townhall.com/tipsheet/bronsonstocking/2020/06/12/its-official-minneapolis-city-council-unanimously-votes-to-abolish-police-n2570582,NDPACKER,Minneapolis is now a third-world sh*thole.,,,Reality Check,6,?
744,The Daily Wire,Chicago Mayor Blasts City Council For Illegally Recording Profane Phone Call A…,[],194 comments,https://www.dailywire.com/news/chicago-mayor-blasts-city-council-for-illegally-recording-profane-phone-call-about-riots,NDPACKER,Black monkeys attacking brown monkeys.  I love it!,,,Kirk Jenkins,2,1
745,Twitchy,‘Miami PD don’t PLAY’: If you’re looking for more footage of cops kneeling you’ll wa…,['2020/06/12'],330 comments,https://twitchy.com/samj-3930/2020/06/12/miami-pd-dont-play-if-youre-looking-for-more-footage-of-cops-kneeling-youll-want-to-skip-this-video-because-holy-cow-watch/,NDPACKER,Thank God for the Miami PD!,,,Don Rosso,14,?
746,Twitchy,‘Miami PD don’t PLAY’: If you’re looking for more footage of cops kneeling you’ll wa…,['2020/06/12'],330 comments,https://twitchy.com/samj-3930/2020/06/12/miami-pd-dont-play-if-youre-looking-for-more-footage-of-cops-kneeling-youll-want-to-skip-this-video-because-holy-cow-watch/,NDPACKER,Who is that little girl that keeps screaming?,,,Guest,3,?
747,Townhall,President Trump Responds to Lawmakers' Negligence in Seattle,['2020/06/12'],572 comments,https://townhall.com/tipsheet/reaganmccarthy/2020/06/12/potus-responds-to-seattle-mayor-n2570554,NDPACKER,It is too late for that.  the chinese will be landing troops in seattle in the near future.,,,Lillian DeVore,0,0
748,Twitchy,CNN reporter telling Anderson Cooper how peaceful CHAZ is being interrupted by an…,['2020/06/12'],105 comments,https://twitchy.com/samj-3930/2020/06/12/cnn-reporter-telling-anderson-cooper-how-peaceful-chaz-is-being-interrupted-by-angry-chaz-inian-the-most-cnn-thing-ever-watch/,NDPACKER,As soon as the ISIS supporters arrive.,,,r t,3,?
749,Twitchy,CNN reporter telling Anderson Cooper how peaceful CHAZ is being interrupted by an…,['2020/06/12'],105 comments,https://twitchy.com/samj-3930/2020/06/12/cnn-reporter-telling-anderson-cooper-how-peaceful-chaz-is-being-interrupted-by-angry-chaz-inian-the-most-cnn-thing-ever-watch/,NDPACKER,Go home Anderson.  Your husband wants you to bend over in front of him.,,,Demosthenes,12,?
750,Twitchy,‘Tensions are HIGH’: Julio Rosas’ video-thread on CHAZ proves once again Mayor…,['2020/06/12'],108 comments,https://twitchy.com/samj-3930/2020/06/12/tensions-are-high-julio-rosas-video-thread-on-chaz-proves-once-again-mayor-jenny-durkan-is-lying-about-the-community-watch/,NDPACKER,"Nice liberal try, but they voted for the democrats...they deserve what they get.",,,NeoKong,3,?
751,Twitchy,‘Tensions are HIGH’: Julio Rosas’ video-thread on CHAZ proves once again Mayor…,['2020/06/12'],108 comments,https://twitchy.com/samj-3930/2020/06/12/tensions-are-high-julio-rosas-video-thread-on-chaz-proves-once-again-mayor-jenny-durkan-is-lying-about-the-community-watch/,NDPACKER,Pay attention people  This is EXACTLY what a third-world sh*thole looks like.  All of the other democrat run cities will look like this in the not too distant future.,,,NeoKong,5,?
752,Twitchy,"OOF! Seattle Mayor Jenny Durkan tweets big, tough thread claiming SHE’S GOT T…",['2020/06/12'],183 comments,https://twitchy.com/samj-3930/2020/06/12/oof-seattle-mayor-jenny-durkan-tweets-big-tough-thread-claiming-shes-got-this-and-its-all-good-trips-over-her-own-police-chief/,NDPACKER,Seattle is officially a third-world sh*thole.,,,Michael,2,?
753,Twitchy,"OOF! Seattle Mayor Jenny Durkan tweets big, tough thread claiming SHE’S GOT T…",['2020/06/12'],183 comments,https://twitchy.com/samj-3930/2020/06/12/oof-seattle-mayor-jenny-durkan-tweets-big-tough-thread-claiming-shes-got-this-and-its-all-good-trips-over-her-own-police-chief/,NDPACKER,Did you take a stupid pill this morning?  Austin is the MOST LIBERAL city in Texas.,,,noman,9,?
754,Twitchy,"OOF! Seattle Mayor Jenny Durkan tweets big, tough thread claiming SHE’S GOT T…",['2020/06/12'],183 comments,https://twitchy.com/samj-3930/2020/06/12/oof-seattle-mayor-jenny-durkan-tweets-big-tough-thread-claiming-shes-got-this-and-its-all-good-trips-over-her-own-police-chief/,NDPACKER,She is just another America hating democrat.  Democrats = American Taliban.,,,John in OK,8,?
755,Twitchy,‘It was a mistake that I’ve learned from’: General apologizes for taking part in Pre…,['2020/06/11'],221 comments,https://twitchy.com/brettt-3136/2020/06/11/it-was-a-mistake-that-ive-learned-from-general-apologizes-for-taking-part-in-president-trumps-walk-to-st-johns-church/,NDPACKER,Mark Milley is a WORLD CLASS COWARD!,,,Andrew White,4,?
756,Twitchy,"‘Dingus, you realize you’re a Democrat, right?’ AOC lecturing Twitter about ‘slav…",['2020/06/11'],192 comments,https://twitchy.com/samj-3930/2020/06/11/dingus-you-realize-youre-a-democrat-right-aoc-lecturing-twitter-about-slaveholder-statues-goes-very-very-wrong/,NDPACKER,"AOC is a democrat, so that automatically qualifies her as a liar.",,,,24,?
757,Twitchy,Eric Swalwell responds to Ted Cruz with what could be the single dumbest thing…,['2020/06/11'],133 comments,https://twitchy.com/gregp-3534/2020/06/11/eric-swalwell-responds-to-ted-cruz-with-what-could-be-the-single-dumbest-thing-weve-ever-read-on-twitter/,NDPACKER,There goes fart boy again...talking out of his a z z.,,,,5,?
758,Twitchy,Class is in SESSION: Ilhan Omar tries picking a fight with Ted Cruz over Colum…,['2020/06/11'],247 comments,https://twitchy.com/samj-3930/2020/06/11/class-is-in-session-ilhan-omar-tries-picking-a-fight-with-ted-cruz-over-columbus-statue-gets-history-lesson-she-wont-forget/,NDPACKER,Ilhan Omar should be the victim of a public Isis beheading.  Film at 11:00.,,,,5,?
759,Twitchy,MASHED tater? Brian Stelter shares NYT article claiming ‘no violence or looting in…,['2020/06/11'],131 comments,https://twitchy.com/samj-3930/2020/06/11/mashed-tater-brian-stelter-shares-nyt-article-claiming-no-violence-or-looting-in-seattle-and-face-plants-over-raz-simone-videos/,NDPACKER,"Brian Stelter:  Still fat.  Still bald.  Still stupid.  Still a sniveling, lying, liberal communist propagandist.",,,Charlie,2,?
760,Twitchy,MASHED tater? Brian Stelter shares NYT article claiming ‘no violence or looting in…,['2020/06/11'],131 comments,https://twitchy.com/samj-3930/2020/06/11/mashed-tater-brian-stelter-shares-nyt-article-claiming-no-violence-or-looting-in-seattle-and-face-plants-over-raz-simone-videos/,NDPACKER,My neighbor's kids remind me of Lord of the Flies.,,,mrdaveno1,0,0
761,Twitchy,So much REEEE! Ted Cruz gets BRUTALLY honest describing rioters who’ve been te…,['2020/06/11'],125 comments,https://twitchy.com/samj-3930/2020/06/11/so-much-reeee-ted-cruz-gets-brutally-honest-describing-rioters-whove-been-tearing-down-statues-and-the-left-just-cant-deal/,NDPACKER,Democrats = American Taliban.  I have been writing that for years.,,,Cliff Cantine *,4,?
762,The Daily Wire,’Domestic Terrorists’: Trump Erupts Over ‘Seattle Autonomous Zone.’ Mayor Resp…,[],735 comments,https://www.dailywire.com/news/domestic-terrorists-trump-erupts-over-seattle-autonomous-zone-mayor-responds-gets-crushed,NDPACKER,I think one well placed kerosene dropped in the Seattle Autonomous Zone would end this.,,,Artificial Human Intelligence,0,0
763,Twitchy,‘Like interviewing a 12-year-old.’ Brit Hume sums up AOC’s interview about de…,['2020/06/11'],195 comments,https://twitchy.com/samj-3930/2020/06/11/like-interviewing-a-12-year-old-brit-hume-sums-up-aocs-interview-about-defunding-the-police-in-1-perfect-tweet/,NDPACKER,What idiots elected the moron known as AOC?,,,thanksdonald,3,?
764,Twitchy,Raz Simone responds to President Trump: ‘I am not a Terrorist Warlord’,['2020/06/11'],295 comments,https://twitchy.com/gregp-3534/2020/06/11/raz-simone-responds-to-president-trump-i-am-not-a-terrorist-warlord/,NDPACKER,It looks like Raz Simone just volunteered to be the first to die when the shooting starts.  I am good with that.,,,LargoPatriot,13,?
765,Twitchy,‘Jeopardy!’ champ Ken Jennings wants conservatives to know that nobody in en…,['2020/06/10'],311 comments,https://twitchy.com/dougp-3137/2020/06/10/jeopardy-champ-ken-jennings-wants-conservatives-to-know-that-nobody-in-entertainment-shares-their-politics-except-maybe-kelsey-grammer/,NDPACKER,His husband does...every night.,,,Gordon,0,0
766,Twitchy,Backpedal in progress: Michigan Gov. Whitmer’s office clarifies support for ‘de…,['2020/06/10'],132 comments,https://twitchy.com/dougp-3137/2020/06/10/backpedal-in-progress-michigan-gov-whitmers-office-clarifies-support-for-defund-the-police-movement-hint-retreat/,NDPACKER,Eva Braun strikes again!,,,G3,6,?
767,The Daily Wire,"WATCH: Leftist Councilwoman Unlocks Doors For Protesters To Flood City Hall,…",[],554 comments,https://www.dailywire.com/news/watch-leftist-councilwoman-unlocks-doors-for-protesters-to-flood-city-hall-demand-democrat-mayor-resign-amid-calls-to-defund-police,NDPACKER,All protesters should be arrested and sent to china.,,,,7,?
768,Twitchy,"‘It’s a financial term, which we know often confuses you’: Carol Roth reminds a narr…",['2020/06/09'],130 comments,https://twitchy.com/dougp-3137/2020/06/09/its-a-financial-term-which-we-know-often-confuses-you-carol-roth-reminds-a-narrative-spinning-aoc-what-defund-means/,NDPACKER,This article is just more proof that ALL democrats lie ALL the time.  Just like the main stream media.,,,BossBass7o7,2,?
769,Twitchy,"Brian Stelter goes after Lara Logan, hides *why* she called out AOC from his readers",['2020/06/10'],187 comments,https://twitchy.com/gregp-3534/2020/06/10/brian-stelter-goes-after-lara-logan-hides-why-she-called-out-aoc-from-his-readers/,NDPACKER,"Brian Stelter:  Still fat.  Still bald.  Still stupid.  Still a sniveling, lying, liberal communist propagandist.",,,Mike Fitz,24,?
770,The Daily Wire,AG Barr On Durham Investigation: ‘I’m Very Troubled By’ What ‘Has Been Called…,[],239 comments,https://www.dailywire.com/news/ag-barr-on-durham-investigation-im-very-troubled-by-what-has-been-called-to-my-attention-so-far,NDPACKER,I hope you are correct.MAGA!,,,TheConservativeMind,2,?
771,Twitchy,‘What the hell just happened?’ Cornel West and Leo Terrell got into a ‘defund the pol…,['2020/06/09'],277 comments,https://twitchy.com/dougp-3137/2020/06/09/what-the-hell-just-happened-cornel-west-and-leo-terrell-got-into-a-defund-the-police-verbal-brawl-on-sean-hannitys-show-and-yowza/,NDPACKER,I thought they ALL supported black lies matter.,,,BLM is a marxist lie,1,?
772,KNPR,"Shutdown Flattens Casino Town, Sends Mayor To The Food Bank",[],1 comments,https://knpr.org/knpr/2020-05/shutdown-flattens-casino-town-sends-mayor-food-bank,NDPACKER,Glad to see the casinos are open.  Good luck everyone in West Wendover.,,,,0,0
773,The Federalist,The Crowd That Booed Jacob Frey Is On The Cusp Of Controlling The Democratic…,['2020/06/09'],956 comments,https://thefederalist.com/2020/06/09/the-crowd-that-booed-jacob-frey-is-on-the-cusp-of-controlling-the-democratic-party/,NDPACKER,Maybe if I run out of bullets and shotgun shells.,,,John Truman,0,0
774,The Daily Wire,"Chicago Mayor, Aldermen Square Off In Shocking, Profanity-Laced Phone Call Ov…",[],330 comments,https://www.dailywire.com/news/chicago-mayor-aldermen-square-off-in-shocking-profanity-laced-phone-call-over-looting,NDPACKER,I bet we never hear this from the main stream media.  Any takers...No?,,,Guest,0,0
775,Twitchy,Defense attorney under LAPD investigation for revolting Instagram posts INCLUDING…,['2020/06/09'],113 comments,https://twitchy.com/samj-3930/2020/06/09/defense-attorney-under-lapd-investigation-for-revolting-instagram-posts-including-a-call-for-murdering-the-police-screenshots/,NDPACKER,Mark McBride needs to sleep with the fishes.,,,Island Shark,5,?
776,Twitchy,OUCH: Nick Searcy has the PERFECT suggestion for Andrew Yang who wants t…,['2020/06/09'],89 comments,https://twitchy.com/samj-3930/2020/06/09/ouch-nick-searcy-has-the-perfect-suggestion-for-andrew-yang-who-wants-to-rename-the-police-something-nicer-and-lol/,NDPACKER,Minneapolis Guardians?  Should they rename the Viqueens the Guardians?  They already have the f a g color.,,,EOD,1,?
777,Twitchy,‘Your tax dollars hard at work’: The ‘science’ behind NPR takes on Trump rall…,['2020/06/09'],116 comments,https://twitchy.com/dougp-3137/2020/06/09/your-tax-dollars-hard-at-work-the-science-behind-npr-takes-on-trump-rallies-vs-protests-inspires-shot-chaser-of-the-day/,NDPACKER,The more we boycott NPR the better off our lives will be.MAGA!,,,jamesben,2,?
778,Twitchy,‘I feel like I’m at ground zero’: INSANE audio leaks of a call between Chicago ald…,['2020/06/09'],233 comments,https://twitchy.com/gregp-3534/2020/06/09/i-feel-like-im-at-ground-zero-insane-audio-leaks-of-a-call-between-chicago-aldermen-and-the-mayor-where-they-discuss-the-looting/,NDPACKER,Nope.  Are you just figuring that out?,,,Clutchdriven,1,?
779,Twitchy,‘I feel like I’m at ground zero’: INSANE audio leaks of a call between Chicago ald…,['2020/06/09'],233 comments,https://twitchy.com/gregp-3534/2020/06/09/i-feel-like-im-at-ground-zero-insane-audio-leaks-of-a-call-between-chicago-aldermen-and-the-mayor-where-they-discuss-the-looting/,NDPACKER,Chicago is now officially a third-world sh*thole.,,,Sabrina Gray,3,?
780,Twitchy,"Alexandria Ocasio-Cortez explains what ‘defund’ the police REALLY means, gets t…",['2020/06/09'],116 comments,https://twitchy.com/gregp-3534/2020/06/09/alexandria-ocasio-cortez-explains-what-defund-the-police-really-means-gets-tripped-up-by-the-facts-yet-again/,NDPACKER,What idiots elected the moron known as AOC?,,,jpfence,3,?
781,The Daily Wire,Top L.A. Democrat Pushed To Cut LAPD Funding While Having Private LAPD Deta…,[],236 comments,https://www.dailywire.com/news/top-l-a-democrat-pushed-to-cut-lapd-funding-while-having-private-lapd-detail-at-her-home-since-april,NDPACKER,Start by ending her taxpayer funded security detail and then publish her address.,,,Nightmare to the left,12,?
782,The Daily Wire,Minneapolis City Council President Lisa Bender: I Am Willing To Stand For a ‘Poli…,[],192 comments,https://www.dailywire.com/news/minneapolis-city-council-president-lisa-bender-i-am-willing-to-stand-for-a-police-free-future,NDPACKER,"Child, please.",,,,0,0
783,The Daily Wire,Attorney General William Barr Explains Why Antifa Arrests Have Not Been Made…,[],290 comments,https://www.dailywire.com/news/attorney-general-william-barr-explains-why-antifa-arrests-have-not-been-made-yet,NDPACKER,What would a gay coward like you know about...anything?,,,Christopher Richey,0,0
784,Twitchy,‘Read the transcript!’ Kayleigh McEnany truth-tramples AOC’s attempt to cry raci…,['2020/06/08'],165 comments,https://twitchy.com/dougp-3137/2020/06/08/read-the-transcript-kayleigh-mcenany-truth-tramples-aocs-attempt-to-cry-racism-over-being-called-a-biden-adviser-instead-of-congresswoman/,NDPACKER,Thank God for Kayleigh McEnany!MAGA!,,,George Sprout,10,?
785,The Daily Wire,"WATCH: White Cops, Civilians Wash Feet Of Black Organizers, Ask For Forgiveness",[],536 comments,https://www.dailywire.com/news/watch-white-cops-civilians-wash-feet-of-black-organizers-ask-for-forgiveness,NDPACKER,WTF is happening!!!?,,,,108,?
